Sheet: Sheet1
A1: Year of our Lord | B1: Septuagesima Sunday | C1: Ash Wednesday | D1: Easter Sunday | E1: Ascension Thursday | F1: Pentecost (Whit-Sunday) | G1: # of Sundays after Pentecost | H1: 1st Sunday of Advent | I1: Letters denoting Sundays | J1: Golden Number | K1: Epact
A2: of:=[Sheet2.A1] -> 2020 | B2: of:=[.D2]-63 -> 2020-02-09 | C2: of:=[.D2]-46 -> 2020-02-26 | D2: of:=[Sheet2.B1] -> 2020-04-12 | E2: of:=[.D2]+39 -> 2020-05-21 | F2: of:=[.D2]+49 -> 2020-05-31 | G2: of:=INT(([Sheet3.G2]-1)/7)-4 -> 25 | H2: of:=[.F2]+[.G2]*7+7 -> 2020-11-29 | I2: of:=OFFSET([Sheet3.$I$1];[Sheet3.D2];0) & IF([Sheet3.C2];" " & OFFSET([Sheet3.$I$1];[Sheet3.D2]+1;0);"") -> e d | J2: of:=MOD([.A2];19)+1 -> 7 | K2: of:=OFFSET([Sheet3.$J$1];[.J2];0) -> V (e)
A3: of:=[Sheet2.A2] -> 2021 | B3: of:=[.D3]-63 -> 2021-01-31 | C3: of:=[.D3]-46 -> 2021-02-17 | D3: of:=[Sheet2.B2] -> 2021-04-04 | E3: of:=[.D3]+39 -> 2021-05-13 | F3: of:=[.D3]+49 -> 2021-05-23 | G3: of:=INT(([Sheet3.G3]-1)/7)-4 -> 26 | H3: of:=[.F3]+[.G3]*7+7 -> 2021-11-28 | I3: of:=OFFSET([Sheet3.$I$1];[Sheet3.D3];0) & IF([Sheet3.C3];" " & OFFSET([Sheet3.$I$1];[Sheet3.D3]+1;0);"") -> c | J3: of:=MOD([.A3];19)+1 -> 8 | K3: of:=OFFSET([Sheet3.$J$1];[.J3];0) -> XVI (r)
A4: of:=[Sheet2.A3] -> 2022 | B4: of:=[.D4]-63 -> 2022-02-13 | C4: of:=[.D4]-46 -> 2022-03-02 | D4: of:=[Sheet2.B3] -> 2022-04-17 | E4: of:=[.D4]+39 -> 2022-05-26 | F4: of:=[.D4]+49 -> 2022-06-05 | G4: of:=INT(([Sheet3.G4]-1)/7)-4 -> 24 | H4: of:=[.F4]+[.G4]*7+7 -> 2022-11-27 | I4: of:=OFFSET([Sheet3.$I$1];[Sheet3.D4];0) & IF([Sheet3.C4];" " & OFFSET([Sheet3.$I$1];[Sheet3.D4]+1;0);"") -> b | J4: of:=MOD([.A4];19)+1 -> 9 | K4: of:=OFFSET([Sheet3.$J$1];[.J4];0) -> XXVII (H)
A5: of:=[Sheet2.A4] -> 2023 | B5: of:=[.D5]-63 -> 2023-02-05 | C5: of:=[.D5]-46 -> 2023-02-22 | D5: of:=[Sheet2.B4] -> 2023-04-09 | E5: of:=[.D5]+39 -> 2023-05-18 | F5: of:=[.D5]+49 -> 2023-05-28 | G5: of:=INT(([Sheet3.G5]-1)/7)-4 -> 26 | H5: of:=[.F5]+[.G5]*7+7 -> 2023-12-03 | I5: of:=OFFSET([Sheet3.$I$1];[Sheet3.D5];0) & IF([Sheet3.C5];" " & OFFSET([Sheet3.$I$1];[Sheet3.D5]+1;0);"") -> A | J5: of:=MOD([.A5];19)+1 -> 10 | K5: of:=OFFSET([Sheet3.$J$1];[.J5];0) -> VIII (h)
A6: of:=[Sheet2.A5] -> 2024 | B6: of:=[.D6]-63 -> 2024-01-28 | C6: of:=[.D6]-46 -> 2024-02-14 | D6: of:=[Sheet2.B5] -> 2024-03-31 | E6: of:=[.D6]+39 -> 2024-05-09 | F6: of:=[.D6]+49 -> 2024-05-19 | G6: of:=INT(([Sheet3.G6]-1)/7)-4 -> 27 | H6: of:=[.F6]+[.G6]*7+7 -> 2024-12-01 | I6: of:=OFFSET([Sheet3.$I$1];[Sheet3.D6];0) & IF([Sheet3.C6];" " & OFFSET([Sheet3.$I$1];[Sheet3.D6]+1;0);"") -> g f | J6: of:=MOD([.A6];19)+1 -> 11 | K6: of:=OFFSET([Sheet3.$J$1];[.J6];0) -> XIX (u)
A7: of:=[Sheet2.A6] -> 2025 | B7: of:=[.D7]-63 -> 2025-02-16 | C7: of:=[.D7]-46 -> 2025-03-05 | D7: of:=[Sheet2.B6] -> 2025-04-20 | E7: of:=[.D7]+39 -> 2025-05-29 | F7: of:=[.D7]+49 -> 2025-06-08 | G7: of:=INT(([Sheet3.G7]-1)/7)-4 -> 24 | H7: of:=[.F7]+[.G7]*7+7 -> 2025-11-30 | I7: of:=OFFSET([Sheet3.$I$1];[Sheet3.D7];0) & IF([Sheet3.C7];" " & OFFSET([Sheet3.$I$1];[Sheet3.D7]+1;0);"") -> e | J7: of:=MOD([.A7];19)+1 -> 12 | K7: of:=OFFSET([Sheet3.$J$1];[.J7];0) -> * (P)
A8: of:=[Sheet2.A7] -> 2026 | B8: of:=[.D8]-63 -> 2026-02-01 | C8: of:=[.D8]-46 -> 2026-02-18 | D8: of:=[Sheet2.B7] -> 2026-04-05 | E8: of:=[.D8]+39 -> 2026-05-14 | F8: of:=[.D8]+49 -> 2026-05-24 | G8: of:=INT(([Sheet3.G8]-1)/7)-4 -> 26 | H8: of:=[.F8]+[.G8]*7+7 -> 2026-11-29 | I8: of:=OFFSET([Sheet3.$I$1];[Sheet3.D8];0) & IF([Sheet3.C8];" " & OFFSET([Sheet3.$I$1];[Sheet3.D8]+1;0);"") -> d | J8: of:=MOD([.A8];19)+1 -> 13 | K8: of:=OFFSET([Sheet3.$J$1];[.J8];0) -> XI (l)
A9: of:=[Sheet2.A8] -> 2027 | B9: of:=[.D9]-63 -> 2027-01-24 | C9: of:=[.D9]-46 -> 2027-02-10 | D9: of:=[Sheet2.B8] -> 2027-03-28 | E9: of:=[.D9]+39 -> 2027-05-06 | F9: of:=[.D9]+49 -> 2027-05-16 | G9: of:=INT(([Sheet3.G9]-1)/7)-4 -> 27 | H9: of:=[.F9]+[.G9]*7+7 -> 2027-11-28 | I9: of:=OFFSET([Sheet3.$I$1];[Sheet3.D9];0) & IF([Sheet3.C9];" " & OFFSET([Sheet3.$I$1];[Sheet3.D9]+1;0);"") -> c | J9: of:=MOD([.A9];19)+1 -> 14 | K9: of:=OFFSET([Sheet3.$J$1];[.J9];0) -> XXII (C)
A10: of:=[Sheet2.A9] -> 2028 | B10: of:=[.D10]-63 -> 2028-02-13 | C10: of:=[.D10]-46 -> 2028-03-01 | D10: of:=[Sheet2.B9] -> 2028-04-16 | E10: of:=[.D10]+39 -> 2028-05-25 | F10: of:=[.D10]+49 -> 2028-06-04 | G10: of:=INT(([Sheet3.G10]-1)/7)-4 -> 25 | H10: of:=[.F10]+[.G10]*7+7 -> 2028-12-03 | I10: of:=OFFSET([Sheet3.$I$1];[Sheet3.D10];0) & IF([Sheet3.C10];" " & OFFSET([Sheet3.$I$1];[Sheet3.D10]+1;0);"") -> b A | J10: of:=MOD([.A10];19)+1 -> 15 | K10: of:=OFFSET([Sheet3.$J$1];[.J10];0) -> III (c)
A11: of:=[Sheet2.A10] -> 2029 | B11: of:=[.D11]-63 -> 2029-01-28 | C11: of:=[.D11]-46 -> 2029-02-14 | D11: of:=[Sheet2.B10] -> 2029-04-01 | E11: of:=[.D11]+39 -> 2029-05-10 | F11: of:=[.D11]+49 -> 2029-05-20 | G11: of:=INT(([Sheet3.G11]-1)/7)-4 -> 27 | H11: of:=[.F11]+[.G11]*7+7 -> 2029-12-02 | I11: of:=OFFSET([Sheet3.$I$1];[Sheet3.D11];0) & IF([Sheet3.C11];" " & OFFSET([Sheet3.$I$1];[Sheet3.D11]+1;0);"") -> g | J11: of:=MOD([.A11];19)+1 -> 16 | K11: of:=OFFSET([Sheet3.$J$1];[.J11];0) -> XIV (p)
A12: of:=[Sheet2.A11] -> 2030 | B12: of:=[.D12]-63 -> 2030-02-17 | C12: of:=[.D12]-46 -> 2030-03-06 | D12: of:=[Sheet2.B11] -> 2030-04-21 | E12: of:=[.D12]+39 -> 2030-05-30 | F12: of:=[.D12]+49 -> 2030-06-09 | G12: of:=INT(([Sheet3.G12]-1)/7)-4 -> 24 | H12: of:=[.F12]+[.G12]*7+7 -> 2030-12-01 | I12: of:=OFFSET([Sheet3.$I$1];[Sheet3.D12];0) & IF([Sheet3.C12];" " & OFFSET([Sheet3.$I$1];[Sheet3.D12]+1;0);"") -> f | J12: of:=MOD([.A12];19)+1 -> 17 | K12: of:=OFFSET([Sheet3.$J$1];[.J12];0) -> 25 (F)
A13: of:=[Sheet2.A12] -> 2031 | B13: of:=[.D13]-63 -> 2031-02-09 | C13: of:=[.D13]-46 -> 2031-02-26 | D13: of:=[Sheet2.B12] -> 2031-04-13 | E13: of:=[.D13]+39 -> 2031-05-22 | F13: of:=[.D13]+49 -> 2031-06-01 | G13: of:=INT(([Sheet3.G13]-1)/7)-4 -> 25 | H13: of:=[.F13]+[.G13]*7+7 -> 2031-11-30 | I13: of:=OFFSET([Sheet3.$I$1];[Sheet3.D13];0) & IF([Sheet3.C13];" " & OFFSET([Sheet3.$I$1];[Sheet3.D13]+1;0);"") -> e | J13: of:=MOD([.A13];19)+1 -> 18 | K13: of:=OFFSET([Sheet3.$J$1];[.J13];0) -> VI (f)
A14: of:=[Sheet2.A13] -> 2032 | B14: of:=[.D14]-63 -> 2032-01-25 | C14: of:=[.D14]-46 -> 2032-02-11 | D14: of:=[Sheet2.B13] -> 2032-03-28 | E14: of:=[.D14]+39 -> 2032-05-06 | F14: of:=[.D14]+49 -> 2032-05-16 | G14: of:=INT(([Sheet3.G14]-1)/7)-4 -> 27 | H14: of:=[.F14]+[.G14]*7+7 -> 2032-11-28 | I14: of:=OFFSET([Sheet3.$I$1];[Sheet3.D14];0) & IF([Sheet3.C14];" " & OFFSET([Sheet3.$I$1];[Sheet3.D14]+1;0);"") -> d c | J14: of:=MOD([.A14];19)+1 -> 19 | K14: of:=OFFSET([Sheet3.$J$1];[.J14];0) -> XVII (s)
A15: of:=[Sheet2.A14] -> 2033 | B15: of:=[.D15]-63 -> 2033-02-13 | C15: of:=[.D15]-46 -> 2033-03-02 | D15: of:=[Sheet2.B14] -> 2033-04-17 | E15: of:=[.D15]+39 -> 2033-05-26 | F15: of:=[.D15]+49 -> 2033-06-05 | G15: of:=INT(([Sheet3.G15]-1)/7)-4 -> 24 | H15: of:=[.F15]+[.G15]*7+7 -> 2033-11-27 | I15: of:=OFFSET([Sheet3.$I$1];[Sheet3.D15];0) & IF([Sheet3.C15];" " & OFFSET([Sheet3.$I$1];[Sheet3.D15]+1;0);"") -> b | J15: of:=MOD([.A15];19)+1 -> 1 | K15: of:=OFFSET([Sheet3.$J$1];[.J15];0) -> XXIX (N)
A16: of:=[Sheet2.A15] -> 2034 | B16: of:=[.D16]-63 -> 2034-02-05 | C16: of:=[.D16]-46 -> 2034-02-22 | D16: of:=[Sheet2.B15] -> 2034-04-09 | E16: of:=[.D16]+39 -> 2034-05-18 | F16: of:=[.D16]+49 -> 2034-05-28 | G16: of:=INT(([Sheet3.G16]-1)/7)-4 -> 26 | H16: of:=[.F16]+[.G16]*7+7 -> 2034-12-03 | I16: of:=OFFSET([Sheet3.$I$1];[Sheet3.D16];0) & IF([Sheet3.C16];" " & OFFSET([Sheet3.$I$1];[Sheet3.D16]+1;0);"") -> A | J16: of:=MOD([.A16];19)+1 -> 2 | K16: of:=OFFSET([Sheet3.$J$1];[.J16];0) -> X (k)
A17: of:=[Sheet2.A16] -> 2035 | B17: of:=[.D17]-63 -> 2035-01-21 | C17: of:=[.D17]-46 -> 2035-02-07 | D17: of:=[Sheet2.B16] -> 2035-03-25 | E17: of:=[.D17]+39 -> 2035-05-03 | F17: of:=[.D17]+49 -> 2035-05-13 | G17: of:=INT(([Sheet3.G17]-1)/7)-4 -> 28 | H17: of:=[.F17]+[.G17]*7+7 -> 2035-12-02 | I17: of:=OFFSET([Sheet3.$I$1];[Sheet3.D17];0) & IF([Sheet3.C17];" " & OFFSET([Sheet3.$I$1];[Sheet3.D17]+1;0);"") -> g | J17: of:=MOD([.A17];19)+1 -> 3 | K17: of:=OFFSET([Sheet3.$J$1];[.J17];0) -> XXI (B)
A18: of:=[Sheet2.A17] -> 2036 | B18: of:=[.D18]-63 -> 2036-02-10 | C18: of:=[.D18]-46 -> 2036-02-27 | D18: of:=[Sheet2.B17] -> 2036-04-13 | E18: of:=[.D18]+39 -> 2036-05-22 | F18: of:=[.D18]+49 -> 2036-06-01 | G18: of:=INT(([Sheet3.G18]-1)/7)-4 -> 25 | H18: of:=[.F18]+[.G18]*7+7 -> 2036-11-30 | I18: of:=OFFSET([Sheet3.$I$1];[Sheet3.D18];0) & IF([Sheet3.C18];" " & OFFSET([Sheet3.$I$1];[Sheet3.D18]+1;0);"") -> f e | J18: of:=MOD([.A18];19)+1 -> 4 | K18: of:=OFFSET([Sheet3.$J$1];[.J18];0) -> II (b)
A19: of:=[Sheet2.A18] -> 2037 | B19: of:=[.D19]-63 -> 2037-02-01 | C19: of:=[.D19]-46 -> 2037-02-18 | D19: of:=[Sheet2.B18] -> 2037-04-05 | E19: of:=[.D19]+39 -> 2037-05-14 | F19: of:=[.D19]+49 -> 2037-05-24 | G19: of:=INT(([Sheet3.G19]-1)/7)-4 -> 26 | H19: of:=[.F19]+[.G19]*7+7 -> 2037-11-29 | I19: of:=OFFSET([Sheet3.$I$1];[Sheet3.D19];0) & IF([Sheet3.C19];" " & OFFSET([Sheet3.$I$1];[Sheet3.D19]+1;0);"") -> d | J19: of:=MOD([.A19];19)+1 -> 5 | K19: of:=OFFSET([Sheet3.$J$1];[.J19];0) -> XIII (n)
A20: of:=[Sheet2.A19] -> 2038 | B20: of:=[.D20]-63 -> 2038-02-21 | C20: of:=[.D20]-46 -> 2038-03-10 | D20: of:=[Sheet2.B19] -> 2038-04-25 | E20: of:=[.D20]+39 -> 2038-06-03 | F20: of:=[.D20]+49 -> 2038-06-13 | G20: of:=INT(([Sheet3.G20]-1)/7)-4 -> 23 | H20: of:=[.F20]+[.G20]*7+7 -> 2038-11-28 | I20: of:=OFFSET([Sheet3.$I$1];[Sheet3.D20];0) & IF([Sheet3.C20];" " & OFFSET([Sheet3.$I$1];[Sheet3.D20]+1;0);"") -> c | J20: of:=MOD([.A20];19)+1 -> 6 | K20: of:=OFFSET([Sheet3.$J$1];[.J20];0) -> XXIV (E)
A21: of:=[Sheet2.A20] -> 2039 | B21: of:=[.D21]-63 -> 2039-02-06 | C21: of:=[.D21]-46 -> 2039-02-23 | D21: of:=[Sheet2.B20] -> 2039-04-10 | E21: of:=[.D21]+39 -> 2039-05-19 | F21: of:=[.D21]+49 -> 2039-05-29 | G21: of:=INT(([Sheet3.G21]-1)/7)-4 -> 25 | H21: of:=[.F21]+[.G21]*7+7 -> 2039-11-27 | I21: of:=OFFSET([Sheet3.$I$1];[Sheet3.D21];0) & IF([Sheet3.C21];" " & OFFSET([Sheet3.$I$1];[Sheet3.D21]+1;0);"") -> b | J21: of:=MOD([.A21];19)+1 -> 7 | K21: of:=OFFSET([Sheet3.$J$1];[.J21];0) -> V (e)
A22: of:=[Sheet2.A21] -> 2040 | B22: of:=[.D22]-63 -> 2040-01-29 | C22: of:=[.D22]-46 -> 2040-02-15 | D22: of:=[Sheet2.B21] -> 2040-04-01 | E22: of:=[.D22]+39 -> 2040-05-10 | F22: of:=[.D22]+49 -> 2040-05-20 | G22: of:=INT(([Sheet3.G22]-1)/7)-4 -> 27 | H22: of:=[.F22]+[.G22]*7+7 -> 2040-12-02 | I22: of:=OFFSET([Sheet3.$I$1];[Sheet3.D22];0) & IF([Sheet3.C22];" " & OFFSET([Sheet3.$I$1];[Sheet3.D22]+1;0);"") -> A g | J22: of:=MOD([.A22];19)+1 -> 8 | K22: of:=OFFSET([Sheet3.$J$1];[.J22];0) -> XVI (r)
A23: of:=[Sheet2.A22] -> 2041 | B23: of:=[.D23]-63 -> 2041-02-17 | C23: of:=[.D23]-46 -> 2041-03-06 | D23: of:=[Sheet2.B22] -> 2041-04-21 | E23: of:=[.D23]+39 -> 2041-05-30 | F23: of:=[.D23]+49 -> 2041-06-09 | G23: of:=INT(([Sheet3.G23]-1)/7)-4 -> 24 | H23: of:=[.F23]+[.G23]*7+7 -> 2041-12-01 | I23: of:=OFFSET([Sheet3.$I$1];[Sheet3.D23];0) & IF([Sheet3.C23];" " & OFFSET([Sheet3.$I$1];[Sheet3.D23]+1;0);"") -> f | J23: of:=MOD([.A23];19)+1 -> 9 | K23: of:=OFFSET([Sheet3.$J$1];[.J23];0) -> XXVII (H)
A24: of:=[Sheet2.A23] -> 2042 | B24: of:=[.D24]-63 -> 2042-02-02 | C24: of:=[.D24]-46 -> 2042-02-19 | D24: of:=[Sheet2.B23] -> 2042-04-06 | E24: of:=[.D24]+39 -> 2042-05-15 | F24: of:=[.D24]+49 -> 2042-05-25 | G24: of:=INT(([Sheet3.G24]-1)/7)-4 -> 26 | H24: of:=[.F24]+[.G24]*7+7 -> 2042-11-30 | I24: of:=OFFSET([Sheet3.$I$1];[Sheet3.D24];0) & IF([Sheet3.C24];" " & OFFSET([Sheet3.$I$1];[Sheet3.D24]+1;0);"") -> e | J24: of:=MOD([.A24];19)+1 -> 10 | K24: of:=OFFSET([Sheet3.$J$1];[.J24];0) -> VIII (h)
A25: of:=[Sheet2.A24] -> 2043 | B25: of:=[.D25]-63 -> 2043-01-25 | C25: of:=[.D25]-46 -> 2043-02-11 | D25: of:=[Sheet2.B24] -> 2043-03-29 | E25: of:=[.D25]+39 -> 2043-05-07 | F25: of:=[.D25]+49 -> 2043-05-17 | G25: of:=INT(([Sheet3.G25]-1)/7)-4 -> 27 | H25: of:=[.F25]+[.G25]*7+7 -> 2043-11-29 | I25: of:=OFFSET([Sheet3.$I$1];[Sheet3.D25];0) & IF([Sheet3.C25];" " & OFFSET([Sheet3.$I$1];[Sheet3.D25]+1;0);"") -> d | J25: of:=MOD([.A25];19)+1 -> 11 | K25: of:=OFFSET([Sheet3.$J$1];[.J25];0) -> XIX (u)
A26: of:=[Sheet2.A25] -> 2044 | B26: of:=[.D26]-63 -> 2044-02-14 | C26: of:=[.D26]-46 -> 2044-03-02 | D26: of:=[Sheet2.B25] -> 2044-04-17 | E26: of:=[.D26]+39 -> 2044-05-26 | F26: of:=[.D26]+49 -> 2044-06-05 | G26: of:=INT(([Sheet3.G26]-1)/7)-4 -> 24 | H26: of:=[.F26]+[.G26]*7+7 -> 2044-11-27 | I26: of:=OFFSET([Sheet3.$I$1];[Sheet3.D26];0) & IF([Sheet3.C26];" " & OFFSET([Sheet3.$I$1];[Sheet3.D26]+1;0);"") -> c b | J26: of:=MOD([.A26];19)+1 -> 12 | K26: of:=OFFSET([Sheet3.$J$1];[.J26];0) -> * (P)
A27: of:=[Sheet2.A26] -> 2045 | B27: of:=[.D27]-63 -> 2045-02-05 | C27: of:=[.D27]-46 -> 2045-02-22 | D27: of:=[Sheet2.B26] -> 2045-04-09 | E27: of:=[.D27]+39 -> 2045-05-18 | F27: of:=[.D27]+49 -> 2045-05-28 | G27: of:=INT(([Sheet3.G27]-1)/7)-4 -> 26 | H27: of:=[.F27]+[.G27]*7+7 -> 2045-12-03 | I27: of:=OFFSET([Sheet3.$I$1];[Sheet3.D27];0) & IF([Sheet3.C27];" " & OFFSET([Sheet3.$I$1];[Sheet3.D27]+1;0);"") -> A | J27: of:=MOD([.A27];19)+1 -> 13 | K27: of:=OFFSET([Sheet3.$J$1];[.J27];0) -> XI (l)
A28: of:=[Sheet2.A27] -> 2046 | B28: of:=[.D28]-63 -> 2046-01-21 | C28: of:=[.D28]-46 -> 2046-02-07 | D28: of:=[Sheet2.B27] -> 2046-03-25 | E28: of:=[.D28]+39 -> 2046-05-03 | F28: of:=[.D28]+49 -> 2046-05-13 | G28: of:=INT(([Sheet3.G28]-1)/7)-4 -> 28 | H28: of:=[.F28]+[.G28]*7+7 -> 2046-12-02 | I28: of:=OFFSET([Sheet3.$I$1];[Sheet3.D28];0) & IF([Sheet3.C28];" " & OFFSET([Sheet3.$I$1];[Sheet3.D28]+1;0);"") -> g | J28: of:=MOD([.A28];19)+1 -> 14 | K28: of:=OFFSET([Sheet3.$J$1];[.J28];0) -> XXII (C)
A29: of:=[Sheet2.A28] -> 2047 | B29: of:=[.D29]-63 -> 2047-02-10 | C29: of:=[.D29]-46 -> 2047-02-27 | D29: of:=[Sheet2.B28] -> 2047-04-14 | E29: of:=[.D29]+39 -> 2047-05-23 | F29: of:=[.D29]+49 -> 2047-06-02 | G29: of:=INT(([Sheet3.G29]-1)/7)-4 -> 25 | H29: of:=[.F29]+[.G29]*7+7 -> 2047-12-01 | I29: of:=OFFSET([Sheet3.$I$1];[Sheet3.D29];0) & IF([Sheet3.C29];" " & OFFSET([Sheet3.$I$1];[Sheet3.D29]+1;0);"") -> f | J29: of:=MOD([.A29];19)+1 -> 15 | K29: of:=OFFSET([Sheet3.$J$1];[.J29];0) -> III (c)
A30: of:=[Sheet2.A29] -> 2048 | B30: of:=[.D30]-63 -> 2048-02-02 | C30: of:=[.D30]-46 -> 2048-02-19 | D30: of:=[Sheet2.B29] -> 2048-04-05 | E30: of:=[.D30]+39 -> 2048-05-14 | F30: of:=[.D30]+49 -> 2048-05-24 | G30: of:=INT(([Sheet3.G30]-1)/7)-4 -> 26 | H30: of:=[.F30]+[.G30]*7+7 -> 2048-11-29 | I30: of:=OFFSET([Sheet3.$I$1];[Sheet3.D30];0) & IF([Sheet3.C30];" " & OFFSET([Sheet3.$I$1];[Sheet3.D30]+1;0);"") -> e d | J30: of:=MOD([.A30];19)+1 -> 16 | K30: of:=OFFSET([Sheet3.$J$1];[.J30];0) -> XIV (p)
A31: of:=[Sheet2.A30] -> 2049 | B31: of:=[.D31]-63 -> 2049-02-14 | C31: of:=[.D31]-46 -> 2049-03-03 | D31: of:=[Sheet2.B30] -> 2049-04-18 | E31: of:=[.D31]+39 -> 2049-05-27 | F31: of:=[.D31]+49 -> 2049-06-06 | G31: of:=INT(([Sheet3.G31]-1)/7)-4 -> 24 | H31: of:=[.F31]+[.G31]*7+7 -> 2049-11-28 | I31: of:=OFFSET([Sheet3.$I$1];[Sheet3.D31];0) & IF([Sheet3.C31];" " & OFFSET([Sheet3.$I$1];[Sheet3.D31]+1;0);"") -> c | J31: of:=MOD([.A31];19)+1 -> 17 | K31: of:=OFFSET([Sheet3.$J$1];[.J31];0) -> 25 (F)
A32: of:=[Sheet2.A31] -> 2050 | B32: of:=[.D32]-63 -> 2050-02-06 | C32: of:=[.D32]-46 -> 2050-02-23 | D32: of:=[Sheet2.B31] -> 2050-04-10 | E32: of:=[.D32]+39 -> 2050-05-19 | F32: of:=[.D32]+49 -> 2050-05-29 | G32: of:=INT(([Sheet3.G32]-1)/7)-4 -> 25 | H32: of:=[.F32]+[.G32]*7+7 -> 2050-11-27 | I32: of:=OFFSET([Sheet3.$I$1];[Sheet3.D32];0) & IF([Sheet3.C32];" " & OFFSET([Sheet3.$I$1];[Sheet3.D32]+1;0);"") -> b | J32: of:=MOD([.A32];19)+1 -> 18 | K32: of:=OFFSET([Sheet3.$J$1];[.J32];0) -> VI (f)
A33: of:=[Sheet2.A32] -> 2051 | B33: of:=[.D33]-63 -> 2051-01-29 | C33: of:=[.D33]-46 -> 2051-02-15 | D33: of:=[Sheet2.B32] -> 2051-04-02 | E33: of:=[.D33]+39 -> 2051-05-11 | F33: of:=[.D33]+49 -> 2051-05-21 | G33: of:=INT(([Sheet3.G33]-1)/7)-4 -> 27 | H33: of:=[.F33]+[.G33]*7+7 -> 2051-12-03 | I33: of:=OFFSET([Sheet3.$I$1];[Sheet3.D33];0) & IF([Sheet3.C33];" " & OFFSET([Sheet3.$I$1];[Sheet3.D33]+1;0);"") -> A | J33: of:=MOD([.A33];19)+1 -> 19 | K33: of:=OFFSET([Sheet3.$J$1];[.J33];0) -> XVII (s)
A34: of:=[Sheet2.A33] -> 2052 | B34: of:=[.D34]-63 -> 2052-02-18 | C34: of:=[.D34]-46 -> 2052-03-06 | D34: of:=[Sheet2.B33] -> 2052-04-21 | E34: of:=[.D34]+39 -> 2052-05-30 | F34: of:=[.D34]+49 -> 2052-06-09 | G34: of:=INT(([Sheet3.G34]-1)/7)-4 -> 24 | H34: of:=[.F34]+[.G34]*7+7 -> 2052-12-01 | I34: of:=OFFSET([Sheet3.$I$1];[Sheet3.D34];0) & IF([Sheet3.C34];" " & OFFSET([Sheet3.$I$1];[Sheet3.D34]+1;0);"") -> g f | J34: of:=MOD([.A34];19)+1 -> 1 | K34: of:=OFFSET([Sheet3.$J$1];[.J34];0) -> XXIX (N)
A35: of:=[Sheet2.A34] -> 2053 | B35: of:=[.D35]-63 -> 2053-02-02 | C35: of:=[.D35]-46 -> 2053-02-19 | D35: of:=[Sheet2.B34] -> 2053-04-06 | E35: of:=[.D35]+39 -> 2053-05-15 | F35: of:=[.D35]+49 -> 2053-05-25 | G35: of:=INT(([Sheet3.G35]-1)/7)-4 -> 26 | H35: of:=[.F35]+[.G35]*7+7 -> 2053-11-30 | I35: of:=OFFSET([Sheet3.$I$1];[Sheet3.D35];0) & IF([Sheet3.C35];" " & OFFSET([Sheet3.$I$1];[Sheet3.D35]+1;0);"") -> e | J35: of:=MOD([.A35];19)+1 -> 2 | K35: of:=OFFSET([Sheet3.$J$1];[.J35];0) -> X (k)
A36: of:=[Sheet2.A35] -> 2054 | B36: of:=[.D36]-63 -> 2054-01-25 | C36: of:=[.D36]-46 -> 2054-02-11 | D36: of:=[Sheet2.B35] -> 2054-03-29 | E36: of:=[.D36]+39 -> 2054-05-07 | F36: of:=[.D36]+49 -> 2054-05-17 | G36: of:=INT(([Sheet3.G36]-1)/7)-4 -> 27 | H36: of:=[.F36]+[.G36]*7+7 -> 2054-11-29 | I36: of:=OFFSET([Sheet3.$I$1];[Sheet3.D36];0) & IF([Sheet3.C36];" " & OFFSET([Sheet3.$I$1];[Sheet3.D36]+1;0);"") -> d | J36: of:=MOD([.A36];19)+1 -> 3 | K36: of:=OFFSET([Sheet3.$J$1];[.J36];0) -> XXI (B)
A37: of:=[Sheet2.A36] -> 2055 | B37: of:=[.D37]-63 -> 2055-02-14 | C37: of:=[.D37]-46 -> 2055-03-03 | D37: of:=[Sheet2.B36] -> 2055-04-18 | E37: of:=[.D37]+39 -> 2055-05-27 | F37: of:=[.D37]+49 -> 2055-06-06 | G37: of:=INT(([Sheet3.G37]-1)/7)-4 -> 24 | H37: of:=[.F37]+[.G37]*7+7 -> 2055-11-28 | I37: of:=OFFSET([Sheet3.$I$1];[Sheet3.D37];0) & IF([Sheet3.C37];" " & OFFSET([Sheet3.$I$1];[Sheet3.D37]+1;0);"") -> c | J37: of:=MOD([.A37];19)+1 -> 4 | K37: of:=OFFSET([Sheet3.$J$1];[.J37];0) -> II (b)
A38: of:=[Sheet2.A37] -> 2056 | B38: of:=[.D38]-63 -> 2056-01-30 | C38: of:=[.D38]-46 -> 2056-02-16 | D38: of:=[Sheet2.B37] -> 2056-04-02 | E38: of:=[.D38]+39 -> 2056-05-11 | F38: of:=[.D38]+49 -> 2056-05-21 | G38: of:=INT(([Sheet3.G38]-1)/7)-4 -> 27 | H38: of:=[.F38]+[.G38]*7+7 -> 2056-12-03 | I38: of:=OFFSET([Sheet3.$I$1];[Sheet3.D38];0) & IF([Sheet3.C38];" " & OFFSET([Sheet3.$I$1];[Sheet3.D38]+1;0);"") -> b A | J38: of:=MOD([.A38];19)+1 -> 5 | K38: of:=OFFSET([Sheet3.$J$1];[.J38];0) -> XIII (n)
A39: of:=[Sheet2.A38] -> 2057 | B39: of:=[.D39]-63 -> 2057-02-18 | C39: of:=[.D39]-46 -> 2057-03-07 | D39: of:=[Sheet2.B38] -> 2057-04-22 | E39: of:=[.D39]+39 -> 2057-05-31 | F39: of:=[.D39]+49 -> 2057-06-10 | G39: of:=INT(([Sheet3.G39]-1)/7)-4 -> 24 | H39: of:=[.F39]+[.G39]*7+7 -> 2057-12-02 | I39: of:=OFFSET([Sheet3.$I$1];[Sheet3.D39];0) & IF([Sheet3.C39];" " & OFFSET([Sheet3.$I$1];[Sheet3.D39]+1;0);"") -> g | J39: of:=MOD([.A39];19)+1 -> 6 | K39: of:=OFFSET([Sheet3.$J$1];[.J39];0) -> XXIV (E)
A40: of:=[Sheet2.A39] -> 2058 | B40: of:=[.D40]-63 -> 2058-02-10 | C40: of:=[.D40]-46 -> 2058-02-27 | D40: of:=[Sheet2.B39] -> 2058-04-14 | E40: of:=[.D40]+39 -> 2058-05-23 | F40: of:=[.D40]+49 -> 2058-06-02 | G40: of:=INT(([Sheet3.G40]-1)/7)-4 -> 25 | H40: of:=[.F40]+[.G40]*7+7 -> 2058-12-01 | I40: of:=OFFSET([Sheet3.$I$1];[Sheet3.D40];0) & IF([Sheet3.C40];" " & OFFSET([Sheet3.$I$1];[Sheet3.D40]+1;0);"") -> f | J40: of:=MOD([.A40];19)+1 -> 7 | K40: of:=OFFSET([Sheet3.$J$1];[.J40];0) -> V (e)
A41: of:=[Sheet2.A40] -> 2059 | B41: of:=[.D41]-63 -> 2059-01-26 | C41: of:=[.D41]-46 -> 2059-02-12 | D41: of:=[Sheet2.B40] -> 2059-03-30 | E41: of:=[.D41]+39 -> 2059-05-08 | F41: of:=[.D41]+49 -> 2059-05-18 | G41: of:=INT(([Sheet3.G41]-1)/7)-4 -> 27 | H41: of:=[.F41]+[.G41]*7+7 -> 2059-11-30 | I41: of:=OFFSET([Sheet3.$I$1];[Sheet3.D41];0) & IF([Sheet3.C41];" " & OFFSET([Sheet3.$I$1];[Sheet3.D41]+1;0);"") -> e | J41: of:=MOD([.A41];19)+1 -> 8 | K41: of:=OFFSET([Sheet3.$J$1];[.J41];0) -> XVI (r)

Sheet: Sheet2
A1: 2020 | B1: of:=[.K1] -> 2020-04-12 | C1: of:=MOD([.A1];19) -> 6 | D1: of:=MOD([.A1];4) -> 0 | E1: of:=MOD([.A1];7) -> 4 | F1: of:=MOD((19*[.C1]+[.H1]);30) -> 18 | G1: of:=MOD((2*[.D1]+4*[.E1]+6*[.F1]+[.I1]);7) -> 3 | H1: of:=IF([.A1]<1700;22;IF([.A1]<1900;23;IF([.A1]<2200;24;25))) -> 24 | I1: of:=IF([.A1]<1700;2;IF([.A1]<1800;3;IF([.A1]<1900;4;IF([.A1]<2100;5;IF([.A1]<2200;6;0))))) -> 5 | J1: of:=IF([.F1]+[.G1]=35;28;IF(AND([.F1]=28;[.G1]=6;[.C1]>10);27;[.F1]+[.G1])) -> 21 | K1: of:=DATE([.A1];3;22)+[.J1] -> 2020-04-12
A2: of:=[.A1]+1 -> 2021 | B2: of:=[.K2] -> 2021-04-04 | C2: of:=MOD([.A2];19) -> 7 | D2: of:=MOD([.A2];4) -> 1 | E2: of:=MOD([.A2];7) -> 5 | F2: of:=MOD((19*[.C2]+[.H2]);30) -> 7 | G2: of:=MOD((2*[.D2]+4*[.E2]+6*[.F2]+[.I2]);7) -> 6 | H2: of:=IF([.A2]<1700;22;IF([.A2]<1900;23;IF([.A2]<2200;24;25))) -> 24 | I2: of:=IF([.A2]<1700;2;IF([.A2]<1800;3;IF([.A2]<1900;4;IF([.A2]<2100;5;IF([.A2]<2200;6;0))))) -> 5 | J2: of:=IF([.F2]+[.G2]=35;28;IF(AND([.F2]=28;[.G2]=6;[.C2]>10);27;[.F2]+[.G2])) -> 13 | K2: of:=DATE([.A2];3;22)+[.J2] -> 2021-04-04
A3: of:=[.A2]+1 -> 2022 | B3: of:=[.K3] -> 2022-04-17 | C3: of:=MOD([.A3];19) -> 8 | D3: of:=MOD([.A3];4) -> 2 | E3: of:=MOD([.A3];7) -> 6 | F3: of:=MOD((19*[.C3]+[.H3]);30) -> 26 | G3: of:=MOD((2*[.D3]+4*[.E3]+6*[.F3]+[.I3]);7) -> 0 | H3: of:=IF([.A3]<1700;22;IF([.A3]<1900;23;IF([.A3]<2200;24;25))) -> 24 | I3: of:=IF([.A3]<1700;2;IF([.A3]<1800;3;IF([.A3]<1900;4;IF([.A3]<2100;5;IF([.A3]<2200;6;0))))) -> 5 | J3: of:=IF([.F3]+[.G3]=35;28;IF(AND([.F3]=28;[.G3]=6;[.C3]>10);27;[.F3]+[.G3])) -> 26 | K3: of:=DATE([.A3];3;22)+[.J3] -> 2022-04-17
A4: of:=[.A3]+1 -> 2023 | B4: of:=[.K4] -> 2023-04-09 | C4: of:=MOD([.A4];19) -> 9 | D4: of:=MOD([.A4];4) -> 3 | E4: of:=MOD([.A4];7) -> 0 | F4: of:=MOD((19*[.C4]+[.H4]);30) -> 15 | G4: of:=MOD((2*[.D4]+4*[.E4]+6*[.F4]+[.I4]);7) -> 3 | H4: of:=IF([.A4]<1700;22;IF([.A4]<1900;23;IF([.A4]<2200;24;25))) -> 24 | I4: of:=IF([.A4]<1700;2;IF([.A4]<1800;3;IF([.A4]<1900;4;IF([.A4]<2100;5;IF([.A4]<2200;6;0))))) -> 5 | J4: of:=IF([.F4]+[.G4]=35;28;IF(AND([.F4]=28;[.G4]=6;[.C4]>10);27;[.F4]+[.G4])) -> 18 | K4: of:=DATE([.A4];3;22)+[.J4] -> 2023-04-09
A5: of:=[.A4]+1 -> 2024 | B5: of:=[.K5] -> 2024-03-31 | C5: of:=MOD([.A5];19) -> 10 | D5: of:=MOD([.A5];4) -> 0 | E5: of:=MOD([.A5];7) -> 1 | F5: of:=MOD((19*[.C5]+[.H5]);30) -> 4 | G5: of:=MOD((2*[.D5]+4*[.E5]+6*[.F5]+[.I5]);7) -> 5 | H5: of:=IF([.A5]<1700;22;IF([.A5]<1900;23;IF([.A5]<2200;24;25))) -> 24 | I5: of:=IF([.A5]<1700;2;IF([.A5]<1800;3;IF([.A5]<1900;4;IF([.A5]<2100;5;IF([.A5]<2200;6;0))))) -> 5 | J5: of:=IF([.F5]+[.G5]=35;28;IF(AND([.F5]=28;[.G5]=6;[.C5]>10);27;[.F5]+[.G5])) -> 9 | K5: of:=DATE([.A5];3;22)+[.J5] -> 2024-03-31
A6: of:=[.A5]+1 -> 2025 | B6: of:=[.K6] -> 2025-04-20 | C6: of:=MOD([.A6];19) -> 11 | D6: of:=MOD([.A6];4) -> 1 | E6: of:=MOD([.A6];7) -> 2 | F6: of:=MOD((19*[.C6]+[.H6]);30) -> 23 | G6: of:=MOD((2*[.D6]+4*[.E6]+6*[.F6]+[.I6]);7) -> 6 | H6: of:=IF([.A6]<1700;22;IF([.A6]<1900;23;IF([.A6]<2200;24;25))) -> 24 | I6: of:=IF([.A6]<1700;2;IF([.A6]<1800;3;IF([.A6]<1900;4;IF([.A6]<2100;5;IF([.A6]<2200;6;0))))) -> 5 | J6: of:=IF([.F6]+[.G6]=35;28;IF(AND([.F6]=28;[.G6]=6;[.C6]>10);27;[.F6]+[.G6])) -> 29 | K6: of:=DATE([.A6];3;22)+[.J6] -> 2025-04-20
A7: of:=[.A6]+1 -> 2026 | B7: of:=[.K7] -> 2026-04-05 | C7: of:=MOD([.A7];19) -> 12 | D7: of:=MOD([.A7];4) -> 2 | E7: of:=MOD([.A7];7) -> 3 | F7: of:=MOD((19*[.C7]+[.H7]);30) -> 12 | G7: of:=MOD((2*[.D7]+4*[.E7]+6*[.F7]+[.I7]);7) -> 2 | H7: of:=IF([.A7]<1700;22;IF([.A7]<1900;23;IF([.A7]<2200;24;25))) -> 24 | I7: of:=IF([.A7]<1700;2;IF([.A7]<1800;3;IF([.A7]<1900;4;IF([.A7]<2100;5;IF([.A7]<2200;6;0))))) -> 5 | J7: of:=IF([.F7]+[.G7]=35;28;IF(AND([.F7]=28;[.G7]=6;[.C7]>10);27;[.F7]+[.G7])) -> 14 | K7: of:=DATE([.A7];3;22)+[.J7] -> 2026-04-05
A8: of:=[.A7]+1 -> 2027 | B8: of:=[.K8] -> 2027-03-28 | C8: of:=MOD([.A8];19) -> 13 | D8: of:=MOD([.A8];4) -> 3 | E8: of:=MOD([.A8];7) -> 4 | F8: of:=MOD((19*[.C8]+[.H8]);30) -> 1 | G8: of:=MOD((2*[.D8]+4*[.E8]+6*[.F8]+[.I8]);7) -> 5 | H8: of:=IF([.A8]<1700;22;IF([.A8]<1900;23;IF([.A8]<2200;24;25))) -> 24 | I8: of:=IF([.A8]<1700;2;IF([.A8]<1800;3;IF([.A8]<1900;4;IF([.A8]<2100;5;IF([.A8]<2200;6;0))))) -> 5 | J8: of:=IF([.F8]+[.G8]=35;28;IF(AND([.F8]=28;[.G8]=6;[.C8]>10);27;[.F8]+[.G8])) -> 6 | K8: of:=DATE([.A8];3;22)+[.J8] -> 2027-03-28
A9: of:=[.A8]+1 -> 2028 | B9: of:=[.K9] -> 2028-04-16 | C9: of:=MOD([.A9];19) -> 14 | D9: of:=MOD([.A9];4) -> 0 | E9: of:=MOD([.A9];7) -> 5 | F9: of:=MOD((19*[.C9]+[.H9]);30) -> 20 | G9: of:=MOD((2*[.D9]+4*[.E9]+6*[.F9]+[.I9]);7) -> 5 | H9: of:=IF([.A9]<1700;22;IF([.A9]<1900;23;IF([.A9]<2200;24;25))) -> 24 | I9: of:=IF([.A9]<1700;2;IF([.A9]<1800;3;IF([.A9]<1900;4;IF([.A9]<2100;5;IF([.A9]<2200;6;0))))) -> 5 | J9: of:=IF([.F9]+[.G9]=35;28;IF(AND([.F9]=28;[.G9]=6;[.C9]>10);27;[.F9]+[.G9])) -> 25 | K9: of:=DATE([.A9];3;22)+[.J9] -> 2028-04-16
A10: of:=[.A9]+1 -> 2029 | B10: of:=[.K10] -> 2029-04-01 | C10: of:=MOD([.A10];19) -> 15 | D10: of:=MOD([.A10];4) -> 1 | E10: of:=MOD([.A10];7) -> 6 | F10: of:=MOD((19*[.C10]+[.H10]);30) -> 9 | G10: of:=MOD((2*[.D10]+4*[.E10]+6*[.F10]+[.I10]);7) -> 1 | H10: of:=IF([.A10]<1700;22;IF([.A10]<1900;23;IF([.A10]<2200;24;25))) -> 24 | I10: of:=IF([.A10]<1700;2;IF([.A10]<1800;3;IF([.A10]<1900;4;IF([.A10]<2100;5;IF([.A10]<2200;6;0))))) -> 5 | J10: of:=IF([.F10]+[.G10]=35;28;IF(AND([.F10]=28;[.G10]=6;[.C10]>10);27;[.F10]+[.G10])) -> 10 | K10: of:=DATE([.A10];3;22)+[.J10] -> 2029-04-01
A11: of:=[.A10]+1 -> 2030 | B11: of:=[.K11] -> 2030-04-21 | C11: of:=MOD([.A11];19) -> 16 | D11: of:=MOD([.A11];4) -> 2 | E11: of:=MOD([.A11];7) -> 0 | F11: of:=MOD((19*[.C11]+[.H11]);30) -> 28 | G11: of:=MOD((2*[.D11]+4*[.E11]+6*[.F11]+[.I11]);7) -> 2 | H11: of:=IF([.A11]<1700;22;IF([.A11]<1900;23;IF([.A11]<2200;24;25))) -> 24 | I11: of:=IF([.A11]<1700;2;IF([.A11]<1800;3;IF([.A11]<1900;4;IF([.A11]<2100;5;IF([.A11]<2200;6;0))))) -> 5 | J11: of:=IF([.F11]+[.G11]=35;28;IF(AND([.F11]=28;[.G11]=6;[.C11]>10);27;[.F11]+[.G11])) -> 30 | K11: of:=DATE([.A11];3;22)+[.J11] -> 2030-04-21
A12: of:=[.A11]+1 -> 2031 | B12: of:=[.K12] -> 2031-04-13 | C12: of:=MOD([.A12];19) -> 17 | D12: of:=MOD([.A12];4) -> 3 | E12: of:=MOD([.A12];7) -> 1 | F12: of:=MOD((19*[.C12]+[.H12]);30) -> 17 | G12: of:=MOD((2*[.D12]+4*[.E12]+6*[.F12]+[.I12]);7) -> 5 | H12: of:=IF([.A12]<1700;22;IF([.A12]<1900;23;IF([.A12]<2200;24;25))) -> 24 | I12: of:=IF([.A12]<1700;2;IF([.A12]<1800;3;IF([.A12]<1900;4;IF([.A12]<2100;5;IF([.A12]<2200;6;0))))) -> 5 | J12: of:=IF([.F12]+[.G12]=35;28;IF(AND([.F12]=28;[.G12]=6;[.C12]>10);27;[.F12]+[.G12])) -> 22 | K12: of:=DATE([.A12];3;22)+[.J12] -> 2031-04-13
A13: of:=[.A12]+1 -> 2032 | B13: of:=[.K13] -> 2032-03-28 | C13: of:=MOD([.A13];19) -> 18 | D13: of:=MOD([.A13];4) -> 0 | E13: of:=MOD([.A13];7) -> 2 | F13: of:=MOD((19*[.C13]+[.H13]);30) -> 6 | G13: of:=MOD((2*[.D13]+4*[.E13]+6*[.F13]+[.I13]);7) -> 0 | H13: of:=IF([.A13]<1700;22;IF([.A13]<1900;23;IF([.A13]<2200;24;25))) -> 24 | I13: of:=IF([.A13]<1700;2;IF([.A13]<1800;3;IF([.A13]<1900;4;IF([.A13]<2100;5;IF([.A13]<2200;6;0))))) -> 5 | J13: of:=IF([.F13]+[.G13]=35;28;IF(AND([.F13]=28;[.G13]=6;[.C13]>10);27;[.F13]+[.G13])) -> 6 | K13: of:=DATE([.A13];3;22)+[.J13] -> 2032-03-28
A14: of:=[.A13]+1 -> 2033 | B14: of:=[.K14] -> 2033-04-17 | C14: of:=MOD([.A14];19) -> 0 | D14: of:=MOD([.A14];4) -> 1 | E14: of:=MOD([.A14];7) -> 3 | F14: of:=MOD((19*[.C14]+[.H14]);30) -> 24 | G14: of:=MOD((2*[.D14]+4*[.E14]+6*[.F14]+[.I14]);7) -> 2 | H14: of:=IF([.A14]<1700;22;IF([.A14]<1900;23;IF([.A14]<2200;24;25))) -> 24 | I14: of:=IF([.A14]<1700;2;IF([.A14]<1800;3;IF([.A14]<1900;4;IF([.A14]<2100;5;IF([.A14]<2200;6;0))))) -> 5 | J14: of:=IF([.F14]+[.G14]=35;28;IF(AND([.F14]=28;[.G14]=6;[.C14]>10);27;[.F14]+[.G14])) -> 26 | K14: of:=DATE([.A14];3;22)+[.J14] -> 2033-04-17
A15: of:=[.A14]+1 -> 2034 | B15: of:=[.K15] -> 2034-04-09 | C15: of:=MOD([.A15];19) -> 1 | D15: of:=MOD([.A15];4) -> 2 | E15: of:=MOD([.A15];7) -> 4 | F15: of:=MOD((19*[.C15]+[.H15]);30) -> 13 | G15: of:=MOD((2*[.D15]+4*[.E15]+6*[.F15]+[.I15]);7) -> 5 | H15: of:=IF([.A15]<1700;22;IF([.A15]<1900;23;IF([.A15]<2200;24;25))) -> 24 | I15: of:=IF([.A15]<1700;2;IF([.A15]<1800;3;IF([.A15]<1900;4;IF([.A15]<2100;5;IF([.A15]<2200;6;0))))) -> 5 | J15: of:=IF([.F15]+[.G15]=35;28;IF(AND([.F15]=28;[.G15]=6;[.C15]>10);27;[.F15]+[.G15])) -> 18 | K15: of:=DATE([.A15];3;22)+[.J15] -> 2034-04-09
A16: of:=[.A15]+1 -> 2035 | B16: of:=[.K16] -> 2035-03-25 | C16: of:=MOD([.A16];19) -> 2 | D16: of:=MOD([.A16];4) -> 3 | E16: of:=MOD([.A16];7) -> 5 | F16: of:=MOD((19*[.C16]+[.H16]);30) -> 2 | G16: of:=MOD((2*[.D16]+4*[.E16]+6*[.F16]+[.I16]);7) -> 1 | H16: of:=IF([.A16]<1700;22;IF([.A16]<1900;23;IF([.A16]<2200;24;25))) -> 24 | I16: of:=IF([.A16]<1700;2;IF([.A16]<1800;3;IF([.A16]<1900;4;IF([.A16]<2100;5;IF([.A16]<2200;6;0))))) -> 5 | J16: of:=IF([.F16]+[.G16]=35;28;IF(AND([.F16]=28;[.G16]=6;[.C16]>10);27;[.F16]+[.G16])) -> 3 | K16: of:=DATE([.A16];3;22)+[.J16] -> 2035-03-25
A17: of:=[.A16]+1 -> 2036 | B17: of:=[.K17] -> 2036-04-13 | C17: of:=MOD([.A17];19) -> 3 | D17: of:=MOD([.A17];4) -> 0 | E17: of:=MOD([.A17];7) -> 6 | F17: of:=MOD((19*[.C17]+[.H17]);30) -> 21 | G17: of:=MOD((2*[.D17]+4*[.E17]+6*[.F17]+[.I17]);7) -> 1 | H17: of:=IF([.A17]<1700;22;IF([.A17]<1900;23;IF([.A17]<2200;24;25))) -> 24 | I17: of:=IF([.A17]<1700;2;IF([.A17]<1800;3;IF([.A17]<1900;4;IF([.A17]<2100;5;IF([.A17]<2200;6;0))))) -> 5 | J17: of:=IF([.F17]+[.G17]=35;28;IF(AND([.F17]=28;[.G17]=6;[.C17]>10);27;[.F17]+[.G17])) -> 22 | K17: of:=DATE([.A17];3;22)+[.J17] -> 2036-04-13
A18: of:=[.A17]+1 -> 2037 | B18: of:=[.K18] -> 2037-04-05 | C18: of:=MOD([.A18];19) -> 4 | D18: of:=MOD([.A18];4) -> 1 | E18: of:=MOD([.A18];7) -> 0 | F18: of:=MOD((19*[.C18]+[.H18]);30) -> 10 | G18: of:=MOD((2*[.D18]+4*[.E18]+6*[.F18]+[.I18]);7) -> 4 | H18: of:=IF([.A18]<1700;22;IF([.A18]<1900;23;IF([.A18]<2200;24;25))) -> 24 | I18: of:=IF([.A18]<1700;2;IF([.A18]<1800;3;IF([.A18]<1900;4;IF([.A18]<2100;5;IF([.A18]<2200;6;0))))) -> 5 | J18: of:=IF([.F18]+[.G18]=35;28;IF(AND([.F18]=28;[.G18]=6;[.C18]>10);27;[.F18]+[.G18])) -> 14 | K18: of:=DATE([.A18];3;22)+[.J18] -> 2037-04-05
A19: of:=[.A18]+1 -> 2038 | B19: of:=[.K19] -> 2038-04-25 | C19: of:=MOD([.A19];19) -> 5 | D19: of:=MOD([.A19];4) -> 2 | E19: of:=MOD([.A19];7) -> 1 | F19: of:=MOD((19*[.C19]+[.H19]);30) -> 29 | G19: of:=MOD((2*[.D19]+4*[.E19]+6*[.F19]+[.I19]);7) -> 5 | H19: of:=IF([.A19]<1700;22;IF([.A19]<1900;23;IF([.A19]<2200;24;25))) -> 24 | I19: of:=IF([.A19]<1700;2;IF([.A19]<1800;3;IF([.A19]<1900;4;IF([.A19]<2100;5;IF([.A19]<2200;6;0))))) -> 5 | J19: of:=IF([.F19]+[.G19]=35;28;IF(AND([.F19]=28;[.G19]=6;[.C19]>10);27;[.F19]+[.G19])) -> 34 | K19: of:=DATE([.A19];3;22)+[.J19] -> 2038-04-25
A20: of:=[.A19]+1 -> 2039 | B20: of:=[.K20] -> 2039-04-10 | C20: of:=MOD([.A20];19) -> 6 | D20: of:=MOD([.A20];4) -> 3 | E20: of:=MOD([.A20];7) -> 2 | F20: of:=MOD((19*[.C20]+[.H20]);30) -> 18 | G20: of:=MOD((2*[.D20]+4*[.E20]+6*[.F20]+[.I20]);7) -> 1 | H20: of:=IF([.A20]<1700;22;IF([.A20]<1900;23;IF([.A20]<2200;24;25))) -> 24 | I20: of:=IF([.A20]<1700;2;IF([.A20]<1800;3;IF([.A20]<1900;4;IF([.A20]<2100;5;IF([.A20]<2200;6;0))))) -> 5 | J20: of:=IF([.F20]+[.G20]=35;28;IF(AND([.F20]=28;[.G20]=6;[.C20]>10);27;[.F20]+[.G20])) -> 19 | K20: of:=DATE([.A20];3;22)+[.J20] -> 2039-04-10
A21: of:=[.A20]+1 -> 2040 | B21: of:=[.K21] -> 2040-04-01 | C21: of:=MOD([.A21];19) -> 7 | D21: of:=MOD([.A21];4) -> 0 | E21: of:=MOD([.A21];7) -> 3 | F21: of:=MOD((19*[.C21]+[.H21]);30) -> 7 | G21: of:=MOD((2*[.D21]+4*[.E21]+6*[.F21]+[.I21]);7) -> 3 | H21: of:=IF([.A21]<1700;22;IF([.A21]<1900;23;IF([.A21]<2200;24;25))) -> 24 | I21: of:=IF([.A21]<1700;2;IF([.A21]<1800;3;IF([.A21]<1900;4;IF([.A21]<2100;5;IF([.A21]<2200;6;0))))) -> 5 | J21: of:=IF([.F21]+[.G21]=35;28;IF(AND([.F21]=28;[.G21]=6;[.C21]>10);27;[.F21]+[.G21])) -> 10 | K21: of:=DATE([.A21];3;22)+[.J21] -> 2040-04-01
A22: of:=[.A21]+1 -> 2041 | B22: of:=[.K22] -> 2041-04-21 | C22: of:=MOD([.A22];19) -> 8 | D22: of:=MOD([.A22];4) -> 1 | E22: of:=MOD([.A22];7) -> 4 | F22: of:=MOD((19*[.C22]+[.H22]);30) -> 26 | G22: of:=MOD((2*[.D22]+4*[.E22]+6*[.F22]+[.I22]);7) -> 4 | H22: of:=IF([.A22]<1700;22;IF([.A22]<1900;23;IF([.A22]<2200;24;25))) -> 24 | I22: of:=IF([.A22]<1700;2;IF([.A22]<1800;3;IF([.A22]<1900;4;IF([.A22]<2100;5;IF([.A22]<2200;6;0))))) -> 5 | J22: of:=IF([.F22]+[.G22]=35;28;IF(AND([.F22]=28;[.G22]=6;[.C22]>10);27;[.F22]+[.G22])) -> 30 | K22: of:=DATE([.A22];3;22)+[.J22] -> 2041-04-21
A23: of:=[.A22]+1 -> 2042 | B23: of:=[.K23] -> 2042-04-06 | C23: of:=MOD([.A23];19) -> 9 | D23: of:=MOD([.A23];4) -> 2 | E23: of:=MOD([.A23];7) -> 5 | F23: of:=MOD((19*[.C23]+[.H23]);30) -> 15 | G23: of:=MOD((2*[.D23]+4*[.E23]+6*[.F23]+[.I23]);7) -> 0 | H23: of:=IF([.A23]<1700;22;IF([.A23]<1900;23;IF([.A23]<2200;24;25))) -> 24 | I23: of:=IF([.A23]<1700;2;IF([.A23]<1800;3;IF([.A23]<1900;4;IF([.A23]<2100;5;IF([.A23]<2200;6;0))))) -> 5 | J23: of:=IF([.F23]+[.G23]=35;28;IF(AND([.F23]=28;[.G23]=6;[.C23]>10);27;[.F23]+[.G23])) -> 15 | K23: of:=DATE([.A23];3;22)+[.J23] -> 2042-04-06
A24: of:=[.A23]+1 -> 2043 | B24: of:=[.K24] -> 2043-03-29 | C24: of:=MOD([.A24];19) -> 10 | D24: of:=MOD([.A24];4) -> 3 | E24: of:=MOD([.A24];7) -> 6 | F24: of:=MOD((19*[.C24]+[.H24]);30) -> 4 | G24: of:=MOD((2*[.D24]+4*[.E24]+6*[.F24]+[.I24]);7) -> 3 | H24: of:=IF([.A24]<1700;22;IF([.A24]<1900;23;IF([.A24]<2200;24;25))) -> 24 | I24: of:=IF([.A24]<1700;2;IF([.A24]<1800;3;IF([.A24]<1900;4;IF([.A24]<2100;5;IF([.A24]<2200;6;0))))) -> 5 | J24: of:=IF([.F24]+[.G24]=35;28;IF(AND([.F24]=28;[.G24]=6;[.C24]>10);27;[.F24]+[.G24])) -> 7 | K24: of:=DATE([.A24];3;22)+[.J24] -> 2043-03-29
A25: of:=[.A24]+1 -> 2044 | B25: of:=[.K25] -> 2044-04-17 | C25: of:=MOD([.A25];19) -> 11 | D25: of:=MOD([.A25];4) -> 0 | E25: of:=MOD([.A25];7) -> 0 | F25: of:=MOD((19*[.C25]+[.H25]);30) -> 23 | G25: of:=MOD((2*[.D25]+4*[.E25]+6*[.F25]+[.I25]);7) -> 3 | H25: of:=IF([.A25]<1700;22;IF([.A25]<1900;23;IF([.A25]<2200;24;25))) -> 24 | I25: of:=IF([.A25]<1700;2;IF([.A25]<1800;3;IF([.A25]<1900;4;IF([.A25]<2100;5;IF([.A25]<2200;6;0))))) -> 5 | J25: of:=IF([.F25]+[.G25]=35;28;IF(AND([.F25]=28;[.G25]=6;[.C25]>10);27;[.F25]+[.G25])) -> 26 | K25: of:=DATE([.A25];3;22)+[.J25] -> 2044-04-17
A26: of:=[.A25]+1 -> 2045 | B26: of:=[.K26] -> 2045-04-09 | C26: of:=MOD([.A26];19) -> 12 | D26: of:=MOD([.A26];4) -> 1 | E26: of:=MOD([.A26];7) -> 1 | F26: of:=MOD((19*[.C26]+[.H26]);30) -> 12 | G26: of:=MOD((2*[.D26]+4*[.E26]+6*[.F26]+[.I26]);7) -> 6 | H26: of:=IF([.A26]<1700;22;IF([.A26]<1900;23;IF([.A26]<2200;24;25))) -> 24 | I26: of:=IF([.A26]<1700;2;IF([.A26]<1800;3;IF([.A26]<1900;4;IF([.A26]<2100;5;IF([.A26]<2200;6;0))))) -> 5 | J26: of:=IF([.F26]+[.G26]=35;28;IF(AND([.F26]=28;[.G26]=6;[.C26]>10);27;[.F26]+[.G26])) -> 18 | K26: of:=DATE([.A26];3;22)+[.J26] -> 2045-04-09
A27: of:=[.A26]+1 -> 2046 | B27: of:=[.K27] -> 2046-03-25 | C27: of:=MOD([.A27];19) -> 13 | D27: of:=MOD([.A27];4) -> 2 | E27: of:=MOD([.A27];7) -> 2 | F27: of:=MOD((19*[.C27]+[.H27]);30) -> 1 | G27: of:=MOD((2*[.D27]+4*[.E27]+6*[.F27]+[.I27]);7) -> 2 | H27: of:=IF([.A27]<1700;22;IF([.A27]<1900;23;IF([.A27]<2200;24;25))) -> 24 | I27: of:=IF([.A27]<1700;2;IF([.A27]<1800;3;IF([.A27]<1900;4;IF([.A27]<2100;5;IF([.A27]<2200;6;0))))) -> 5 | J27: of:=IF([.F27]+[.G27]=35;28;IF(AND([.F27]=28;[.G27]=6;[.C27]>10);27;[.F27]+[.G27])) -> 3 | K27: of:=DATE([.A27];3;22)+[.J27] -> 2046-03-25
A28: of:=[.A27]+1 -> 2047 | B28: of:=[.K28] -> 2047-04-14 | C28: of:=MOD([.A28];19) -> 14 | D28: of:=MOD([.A28];4) -> 3 | E28: of:=MOD([.A28];7) -> 3 | F28: of:=MOD((19*[.C28]+[.H28]);30) -> 20 | G28: of:=MOD((2*[.D28]+4*[.E28]+6*[.F28]+[.I28]);7) -> 3 | H28: of:=IF([.A28]<1700;22;IF([.A28]<1900;23;IF([.A28]<2200;24;25))) -> 24 | I28: of:=IF([.A28]<1700;2;IF([.A28]<1800;3;IF([.A28]<1900;4;IF([.A28]<2100;5;IF([.A28]<2200;6;0))))) -> 5 | J28: of:=IF([.F28]+[.G28]=35;28;IF(AND([.F28]=28;[.G28]=6;[.C28]>10);27;[.F28]+[.G28])) -> 23 | K28: of:=DATE([.A28];3;22)+[.J28] -> 2047-04-14
A29: of:=[.A28]+1 -> 2048 | B29: of:=[.K29] -> 2048-04-05 | C29: of:=MOD([.A29];19) -> 15 | D29: of:=MOD([.A29];4) -> 0 | E29: of:=MOD([.A29];7) -> 4 | F29: of:=MOD((19*[.C29]+[.H29]);30) -> 9 | G29: of:=MOD((2*[.D29]+4*[.E29]+6*[.F29]+[.I29]);7) -> 5 | H29: of:=IF([.A29]<1700;22;IF([.A29]<1900;23;IF([.A29]<2200;24;25))) -> 24 | I29: of:=IF([.A29]<1700;2;IF([.A29]<1800;3;IF([.A29]<1900;4;IF([.A29]<2100;5;IF([.A29]<2200;6;0))))) -> 5 | J29: of:=IF([.F29]+[.G29]=35;28;IF(AND([.F29]=28;[.G29]=6;[.C29]>10);27;[.F29]+[.G29])) -> 14 | K29: of:=DATE([.A29];3;22)+[.J29] -> 2048-04-05
A30: of:=[.A29]+1 -> 2049 | B30: of:=[.K30] -> 2049-04-18 | C30: of:=MOD([.A30];19) -> 16 | D30: of:=MOD([.A30];4) -> 1 | E30: of:=MOD([.A30];7) -> 5 | F30: of:=MOD((19*[.C30]+[.H30]);30) -> 28 | G30: of:=MOD((2*[.D30]+4*[.E30]+6*[.F30]+[.I30]);7) -> 6 | H30: of:=IF([.A30]<1700;22;IF([.A30]<1900;23;IF([.A30]<2200;24;25))) -> 24 | I30: of:=IF([.A30]<1700;2;IF([.A30]<1800;3;IF([.A30]<1900;4;IF([.A30]<2100;5;IF([.A30]<2200;6;0))))) -> 5 | J30: of:=IF([.F30]+[.G30]=35;28;IF(AND([.F30]=28;[.G30]=6;[.C30]>10);27;[.F30]+[.G30])) -> 27 | K30: of:=DATE([.A30];3;22)+[.J30] -> 2049-04-18
A31: of:=[.A30]+1 -> 2050 | B31: of:=[.K31] -> 2050-04-10 | C31: of:=MOD([.A31];19) -> 17 | D31: of:=MOD([.A31];4) -> 2 | E31: of:=MOD([.A31];7) -> 6 | F31: of:=MOD((19*[.C31]+[.H31]);30) -> 17 | G31: of:=MOD((2*[.D31]+4*[.E31]+6*[.F31]+[.I31]);7) -> 2 | H31: of:=IF([.A31]<1700;22;IF([.A31]<1900;23;IF([.A31]<2200;24;25))) -> 24 | I31: of:=IF([.A31]<1700;2;IF([.A31]<1800;3;IF([.A31]<1900;4;IF([.A31]<2100;5;IF([.A31]<2200;6;0))))) -> 5 | J31: of:=IF([.F31]+[.G31]=35;28;IF(AND([.F31]=28;[.G31]=6;[.C31]>10);27;[.F31]+[.G31])) -> 19 | K31: of:=DATE([.A31];3;22)+[.J31] -> 2050-04-10
A32: of:=[.A31]+1 -> 2051 | B32: of:=[.K32] -> 2051-04-02 | C32: of:=MOD([.A32];19) -> 18 | D32: of:=MOD([.A32];4) -> 3 | E32: of:=MOD([.A32];7) -> 0 | F32: of:=MOD((19*[.C32]+[.H32]);30) -> 6 | G32: of:=MOD((2*[.D32]+4*[.E32]+6*[.F32]+[.I32]);7) -> 5 | H32: of:=IF([.A32]<1700;22;IF([.A32]<1900;23;IF([.A32]<2200;24;25))) -> 24 | I32: of:=IF([.A32]<1700;2;IF([.A32]<1800;3;IF([.A32]<1900;4;IF([.A32]<2100;5;IF([.A32]<2200;6;0))))) -> 5 | J32: of:=IF([.F32]+[.G32]=35;28;IF(AND([.F32]=28;[.G32]=6;[.C32]>10);27;[.F32]+[.G32])) -> 11 | K32: of:=DATE([.A32];3;22)+[.J32] -> 2051-04-02
A33: of:=[.A32]+1 -> 2052 | B33: of:=[.K33] -> 2052-04-21 | C33: of:=MOD([.A33];19) -> 0 | D33: of:=MOD([.A33];4) -> 0 | E33: of:=MOD([.A33];7) -> 1 | F33: of:=MOD((19*[.C33]+[.H33]);30) -> 24 | G33: of:=MOD((2*[.D33]+4*[.E33]+6*[.F33]+[.I33]);7) -> 6 | H33: of:=IF([.A33]<1700;22;IF([.A33]<1900;23;IF([.A33]<2200;24;25))) -> 24 | I33: of:=IF([.A33]<1700;2;IF([.A33]<1800;3;IF([.A33]<1900;4;IF([.A33]<2100;5;IF([.A33]<2200;6;0))))) -> 5 | J33: of:=IF([.F33]+[.G33]=35;28;IF(AND([.F33]=28;[.G33]=6;[.C33]>10);27;[.F33]+[.G33])) -> 30 | K33: of:=DATE([.A33];3;22)+[.J33] -> 2052-04-21
A34: of:=[.A33]+1 -> 2053 | B34: of:=[.K34] -> 2053-04-06 | C34: of:=MOD([.A34];19) -> 1 | D34: of:=MOD([.A34];4) -> 1 | E34: of:=MOD([.A34];7) -> 2 | F34: of:=MOD((19*[.C34]+[.H34]);30) -> 13 | G34: of:=MOD((2*[.D34]+4*[.E34]+6*[.F34]+[.I34]);7) -> 2 | H34: of:=IF([.A34]<1700;22;IF([.A34]<1900;23;IF([.A34]<2200;24;25))) -> 24 | I34: of:=IF([.A34]<1700;2;IF([.A34]<1800;3;IF([.A34]<1900;4;IF([.A34]<2100;5;IF([.A34]<2200;6;0))))) -> 5 | J34: of:=IF([.F34]+[.G34]=35;28;IF(AND([.F34]=28;[.G34]=6;[.C34]>10);27;[.F34]+[.G34])) -> 15 | K34: of:=DATE([.A34];3;22)+[.J34] -> 2053-04-06
A35: of:=[.A34]+1 -> 2054 | B35: of:=[.K35] -> 2054-03-29 | C35: of:=MOD([.A35];19) -> 2 | D35: of:=MOD([.A35];4) -> 2 | E35: of:=MOD([.A35];7) -> 3 | F35: of:=MOD((19*[.C35]+[.H35]);30) -> 2 | G35: of:=MOD((2*[.D35]+4*[.E35]+6*[.F35]+[.I35]);7) -> 5 | H35: of:=IF([.A35]<1700;22;IF([.A35]<1900;23;IF([.A35]<2200;24;25))) -> 24 | I35: of:=IF([.A35]<1700;2;IF([.A35]<1800;3;IF([.A35]<1900;4;IF([.A35]<2100;5;IF([.A35]<2200;6;0))))) -> 5 | J35: of:=IF([.F35]+[.G35]=35;28;IF(AND([.F35]=28;[.G35]=6;[.C35]>10);27;[.F35]+[.G35])) -> 7 | K35: of:=DATE([.A35];3;22)+[.J35] -> 2054-03-29
A36: of:=[.A35]+1 -> 2055 | B36: of:=[.K36] -> 2055-04-18 | C36: of:=MOD([.A36];19) -> 3 | D36: of:=MOD([.A36];4) -> 3 | E36: of:=MOD([.A36];7) -> 4 | F36: of:=MOD((19*[.C36]+[.H36]);30) -> 21 | G36: of:=MOD((2*[.D36]+4*[.E36]+6*[.F36]+[.I36]);7) -> 6 | H36: of:=IF([.A36]<1700;22;IF([.A36]<1900;23;IF([.A36]<2200;24;25))) -> 24 | I36: of:=IF([.A36]<1700;2;IF([.A36]<1800;3;IF([.A36]<1900;4;IF([.A36]<2100;5;IF([.A36]<2200;6;0))))) -> 5 | J36: of:=IF([.F36]+[.G36]=35;28;IF(AND([.F36]=28;[.G36]=6;[.C36]>10);27;[.F36]+[.G36])) -> 27 | K36: of:=DATE([.A36];3;22)+[.J36] -> 2055-04-18
A37: of:=[.A36]+1 -> 2056 | B37: of:=[.K37] -> 2056-04-02 | C37: of:=MOD([.A37];19) -> 4 | D37: of:=MOD([.A37];4) -> 0 | E37: of:=MOD([.A37];7) -> 5 | F37: of:=MOD((19*[.C37]+[.H37]);30) -> 10 | G37: of:=MOD((2*[.D37]+4*[.E37]+6*[.F37]+[.I37]);7) -> 1 | H37: of:=IF([.A37]<1700;22;IF([.A37]<1900;23;IF([.A37]<2200;24;25))) -> 24 | I37: of:=IF([.A37]<1700;2;IF([.A37]<1800;3;IF([.A37]<1900;4;IF([.A37]<2100;5;IF([.A37]<2200;6;0))))) -> 5 | J37: of:=IF([.F37]+[.G37]=35;28;IF(AND([.F37]=28;[.G37]=6;[.C37]>10);27;[.F37]+[.G37])) -> 11 | K37: of:=DATE([.A37];3;22)+[.J37] -> 2056-04-02
A38: of:=[.A37]+1 -> 2057 | B38: of:=[.K38] -> 2057-04-22 | C38: of:=MOD([.A38];19) -> 5 | D38: of:=MOD([.A38];4) -> 1 | E38: of:=MOD([.A38];7) -> 6 | F38: of:=MOD((19*[.C38]+[.H38]);30) -> 29 | G38: of:=MOD((2*[.D38]+4*[.E38]+6*[.F38]+[.I38]);7) -> 2 | H38: of:=IF([.A38]<1700;22;IF([.A38]<1900;23;IF([.A38]<2200;24;25))) -> 24 | I38: of:=IF([.A38]<1700;2;IF([.A38]<1800;3;IF([.A38]<1900;4;IF([.A38]<2100;5;IF([.A38]<2200;6;0))))) -> 5 | J38: of:=IF([.F38]+[.G38]=35;28;IF(AND([.F38]=28;[.G38]=6;[.C38]>10);27;[.F38]+[.G38])) -> 31 | K38: of:=DATE([.A38];3;22)+[.J38] -> 2057-04-22
A39: of:=[.A38]+1 -> 2058 | B39: of:=[.K39] -> 2058-04-14 | C39: of:=MOD([.A39];19) -> 6 | D39: of:=MOD([.A39];4) -> 2 | E39: of:=MOD([.A39];7) -> 0 | F39: of:=MOD((19*[.C39]+[.H39]);30) -> 18 | G39: of:=MOD((2*[.D39]+4*[.E39]+6*[.F39]+[.I39]);7) -> 5 | H39: of:=IF([.A39]<1700;22;IF([.A39]<1900;23;IF([.A39]<2200;24;25))) -> 24 | I39: of:=IF([.A39]<1700;2;IF([.A39]<1800;3;IF([.A39]<1900;4;IF([.A39]<2100;5;IF([.A39]<2200;6;0))))) -> 5 | J39: of:=IF([.F39]+[.G39]=35;28;IF(AND([.F39]=28;[.G39]=6;[.C39]>10);27;[.F39]+[.G39])) -> 23 | K39: of:=DATE([.A39];3;22)+[.J39] -> 2058-04-14
A40: of:=[.A39]+1 -> 2059 | B40: of:=[.K40] -> 2059-03-30 | C40: of:=MOD([.A40];19) -> 7 | D40: of:=MOD([.A40];4) -> 3 | E40: of:=MOD([.A40];7) -> 1 | F40: of:=MOD((19*[.C40]+[.H40]);30) -> 7 | G40: of:=MOD((2*[.D40]+4*[.E40]+6*[.F40]+[.I40]);7) -> 1 | H40: of:=IF([.A40]<1700;22;IF([.A40]<1900;23;IF([.A40]<2200;24;25))) -> 24 | I40: of:=IF([.A40]<1700;2;IF([.A40]<1800;3;IF([.A40]<1900;4;IF([.A40]<2100;5;IF([.A40]<2200;6;0))))) -> 5 | J40: of:=IF([.F40]+[.G40]=35;28;IF(AND([.F40]=28;[.G40]=6;[.C40]>10);27;[.F40]+[.G40])) -> 8 | K40: of:=DATE([.A40];3;22)+[.J40] -> 2059-03-30
A41: of:=[.A40]+1 -> 2060 | B41: of:=[.K41] -> 2060-04-18 | C41: of:=MOD([.A41];19) -> 8 | D41: of:=MOD([.A41];4) -> 0 | E41: of:=MOD([.A41];7) -> 2 | F41: of:=MOD((19*[.C41]+[.H41]);30) -> 26 | G41: of:=MOD((2*[.D41]+4*[.E41]+6*[.F41]+[.I41]);7) -> 1 | H41: of:=IF([.A41]<1700;22;IF([.A41]<1900;23;IF([.A41]<2200;24;25))) -> 24 | I41: of:=IF([.A41]<1700;2;IF([.A41]<1800;3;IF([.A41]<1900;4;IF([.A41]<2100;5;IF([.A41]<2200;6;0))))) -> 5 | J41: of:=IF([.F41]+[.G41]=35;28;IF(AND([.F41]=28;[.G41]=6;[.C41]>10);27;[.F41]+[.G41])) -> 27 | K41: of:=DATE([.A41];3;22)+[.J41] -> 2060-04-18

Sheet: Sheet3
H1: Christmas | I1: Sundays | J1: Epacts | L1: Epacts
A2: of:=[Sheet2.A1] -> 2020 | C2: of:=ORG.OPENOFFICE.ISLEAPYEAR([Sheet1.D2]) -> 1 | D2: of:=WEEKDAY(DATE([Sheet1.A2];1;1)) -> 4 | G2: of:=[.H2]-[Sheet1.F2] -> 208 | H2: of:=DATE([Sheet1.A2];12;25) -> 2020-12-25 | I2: A | J2: of:=[.M2] & " (" & [.L2] & ")" -> XXIX (N) | K2: a | L2: N | M2: XXIX | N2: 1
A3: of:=[Sheet2.A2] -> 2021 | C3: of:=ORG.OPENOFFICE.ISLEAPYEAR([Sheet1.D3]) -> 0 | D3: of:=WEEKDAY(DATE([Sheet1.A3];1;1)) -> 6 | G3: of:=[.H3]-[Sheet1.F3] -> 216 | H3: of:=DATE([Sheet1.A3];12;25) -> 2021-12-25 | I3: g | J3: of:=[.M3] & " (" & [.L3] & ")" -> X (k) | K3: b | L3: k | M3: X | N3: of:=[.N2]+1 -> 2
A4: of:=[Sheet2.A3] -> 2022 | C4: of:=ORG.OPENOFFICE.ISLEAPYEAR([Sheet1.D4]) -> 0 | D4: of:=WEEKDAY(DATE([Sheet1.A4];1;1)) -> 7 | G4: of:=[.H4]-[Sheet1.F4] -> 203 | H4: of:=DATE([Sheet1.A4];12;25) -> 2022-12-25 | I4: f | J4: of:=[.M4] & " (" & [.L4] & ")" -> XXI (B) | K4: c | L4: B | M4: XXI | N4: of:=[.N3]+1 -> 3
A5: of:=[Sheet2.A4] -> 2023 | C5: of:=ORG.OPENOFFICE.ISLEAPYEAR([Sheet1.D5]) -> 0 | D5: of:=WEEKDAY(DATE([Sheet1.A5];1;1)) -> 1 | G5: of:=[.H5]-[Sheet1.F5] -> 211 | H5: of:=DATE([Sheet1.A5];12;25) -> 2023-12-25 | I5: e | J5: of:=[.M5] & " (" & [.L5] & ")" -> II (b) | K5: d | L5: b | M5: II | N5: of:=[.N4]+1 -> 4
A6: of:=[Sheet2.A5] -> 2024 | C6: of:=ORG.OPENOFFICE.ISLEAPYEAR([Sheet1.D6]) -> 1 | D6: of:=WEEKDAY(DATE([Sheet1.A6];1;1)) -> 2 | G6: of:=[.H6]-[Sheet1.F6] -> 220 | H6: of:=DATE([Sheet1.A6];12;25) -> 2024-12-25 | I6: d | J6: of:=[.M6] & " (" & [.L6] & ")" -> XIII (n) | K6: e | L6: n | M6: XIII | N6: of:=[.N5]+1 -> 5
A7: of:=[Sheet2.A6] -> 2025 | C7: of:=ORG.OPENOFFICE.ISLEAPYEAR([Sheet1.D7]) -> 0 | D7: of:=WEEKDAY(DATE([Sheet1.A7];1;1)) -> 4 | G7: of:=[.H7]-[Sheet1.F7] -> 200 | H7: of:=DATE([Sheet1.A7];12;25) -> 2025-12-25 | I7: c | J7: of:=[.M7] & " (" & [.L7] & ")" -> XXIV (E) | K7: f | L7: E | M7: XXIV | N7: of:=[.N6]+1 -> 6
A8: of:=[Sheet2.A7] -> 2026 | C8: of:=ORG.OPENOFFICE.ISLEAPYEAR([Sheet1.D8]) -> 0 | D8: of:=WEEKDAY(DATE([Sheet1.A8];1;1)) -> 5 | G8: of:=[.H8]-[Sheet1.F8] -> 215 | H8: of:=DATE([Sheet1.A8];12;25) -> 2026-12-25 | I8: b | J8: of:=[.M8] & " (" & [.L8] & ")" -> V (e) | K8: g | L8: e | M8: V | N8: of:=[.N7]+1 -> 7
A9: of:=[Sheet2.A8] -> 2027 | C9: of:=ORG.OPENOFFICE.ISLEAPYEAR([Sheet1.D9]) -> 0 | D9: of:=WEEKDAY(DATE([Sheet1.A9];1;1)) -> 6 | G9: of:=[.H9]-[Sheet1.F9] -> 223 | H9: of:=DATE([Sheet1.A9];12;25) -> 2027-12-25 | I9: A | J9: of:=[.M9] & " (" & [.L9] & ")" -> XVI (r) | K9: h | L9: r | M9: XVI | N9: of:=[.N8]+1 -> 8
A10: of:=[Sheet2.A9] -> 2028 | C10: of:=ORG.OPENOFFICE.ISLEAPYEAR([Sheet1.D10]) -> 1 | D10: of:=WEEKDAY(DATE([Sheet1.A10];1;1)) -> 7 | G10: of:=[.H10]-[Sheet1.F10] -> 204 | H10: of:=DATE([Sheet1.A10];12;25) -> 2028-12-25 | J10: of:=[.M10] & " (" & [.L10] & ")" -> XXVII (H) | K10: i | L10: H | M10: XXVII | N10: of:=[.N9]+1 -> 9
A11: of:=[Sheet2.A10] -> 2029 | C11: of:=ORG.OPENOFFICE.ISLEAPYEAR([Sheet1.D11]) -> 0 | D11: of:=WEEKDAY(DATE([Sheet1.A11];1;1)) -> 2 | G11: of:=[.H11]-[Sheet1.F11] -> 219 | H11: of:=DATE([Sheet1.A11];12;25) -> 2029-12-25 | J11: of:=[.M11] & " (" & [.L11] & ")" -> VIII (h) | K11: j | L11: h | M11: VIII | N11: of:=[.N10]+1 -> 10
A12: of:=[Sheet2.A11] -> 2030 | C12: of:=ORG.OPENOFFICE.ISLEAPYEAR([Sheet1.D12]) -> 0 | D12: of:=WEEKDAY(DATE([Sheet1.A12];1;1)) -> 3 | G12: of:=[.H12]-[Sheet1.F12] -> 199 | H12: of:=DATE([Sheet1.A12];12;25) -> 2030-12-25 | J12: of:=[.M12] & " (" & [.L12] & ")" -> XIX (u) | K12: k | L12: u | M12: XIX | N12: of:=[.N11]+1 -> 11
A13: of:=[Sheet2.A12] -> 2031 | C13: of:=ORG.OPENOFFICE.ISLEAPYEAR([Sheet1.D13]) -> 0 | D13: of:=WEEKDAY(DATE([Sheet1.A13];1;1)) -> 4 | G13: of:=[.H13]-[Sheet1.F13] -> 207 | H13: of:=DATE([Sheet1.A13];12;25) -> 2031-12-25 | J13: of:=[.M13] & " (" & [.L13] & ")" -> * (P) | K13: l | L13: P | M13: * | N13: of:=[.N12]+1 -> 12
A14: of:=[Sheet2.A13] -> 2032 | C14: of:=ORG.OPENOFFICE.ISLEAPYEAR([Sheet1.D14]) -> 1 | D14: of:=WEEKDAY(DATE([Sheet1.A14];1;1)) -> 5 | G14: of:=[.H14]-[Sheet1.F14] -> 223 | H14: of:=DATE([Sheet1.A14];12;25) -> 2032-12-25 | J14: of:=[.M14] & " (" & [.L14] & ")" -> XI (l) | K14: m | L14: l | M14: XI | N14: of:=[.N13]+1 -> 13
A15: of:=[Sheet2.A14] -> 2033 | C15: of:=ORG.OPENOFFICE.ISLEAPYEAR([Sheet1.D15]) -> 0 | D15: of:=WEEKDAY(DATE([Sheet1.A15];1;1)) -> 7 | G15: of:=[.H15]-[Sheet1.F15] -> 203 | H15: of:=DATE([Sheet1.A15];12;25) -> 2033-12-25 | J15: of:=[.M15] & " (" & [.L15] & ")" -> XXII (C) | K15: n | L15: C | M15: XXII | N15: of:=[.N14]+1 -> 14
A16: of:=[Sheet2.A15] -> 2034 | C16: of:=ORG.OPENOFFICE.ISLEAPYEAR([Sheet1.D16]) -> 0 | D16: of:=WEEKDAY(DATE([Sheet1.A16];1;1)) -> 1 | G16: of:=[.H16]-[Sheet1.F16] -> 211 | H16: of:=DATE([Sheet1.A16];12;25) -> 2034-12-25 | J16: of:=[.M16] & " (" & [.L16] & ")" -> III (c) | K16: o | L16: c | M16: III | N16: of:=[.N15]+1 -> 15
A17: of:=[Sheet2.A16] -> 2035 | C17: of:=ORG.OPENOFFICE.ISLEAPYEAR([Sheet1.D17]) -> 0 | D17: of:=WEEKDAY(DATE([Sheet1.A17];1;1)) -> 2 | G17: of:=[.H17]-[Sheet1.F17] -> 226 | H17: of:=DATE([Sheet1.A17];12;25) -> 2035-12-25 | J17: of:=[.M17] & " (" & [.L17] & ")" -> XIV (p) | K17: p | L17: p | M17: XIV | N17: of:=[.N16]+1 -> 16
A18: of:=[Sheet2.A17] -> 2036 | C18: of:=ORG.OPENOFFICE.ISLEAPYEAR([Sheet1.D18]) -> 1 | D18: of:=WEEKDAY(DATE([Sheet1.A18];1;1)) -> 3 | G18: of:=[.H18]-[Sheet1.F18] -> 207 | H18: of:=DATE([Sheet1.A18];12;25) -> 2036-12-25 | J18: of:=[.M18] & " (" & [.L18] & ")" -> 25 (F) | K18: q | L18: F | M18: 25 | N18: of:=[.N17]+1 -> 17
A19: of:=[Sheet2.A18] -> 2037 | C19: of:=ORG.OPENOFFICE.ISLEAPYEAR([Sheet1.D19]) -> 0 | D19: of:=WEEKDAY(DATE([Sheet1.A19];1;1)) -> 5 | G19: of:=[.H19]-[Sheet1.F19] -> 215 | H19: of:=DATE([Sheet1.A19];12;25) -> 2037-12-25 | J19: of:=[.M19] & " (" & [.L19] & ")" -> VI (f) | K19: r | L19: f | M19: VI | N19: of:=[.N18]+1 -> 18
A20: of:=[Sheet2.A19] -> 2038 | C20: of:=ORG.OPENOFFICE.ISLEAPYEAR([Sheet1.D20]) -> 0 | D20: of:=WEEKDAY(DATE([Sheet1.A20];1;1)) -> 6 | G20: of:=[.H20]-[Sheet1.F20] -> 195 | H20: of:=DATE([Sheet1.A20];12;25) -> 2038-12-25 | J20: of:=[.M20] & " (" & [.L20] & ")" -> XVII (s) | K20: s | L20: s | M20: XVII | N20: of:=[.N19]+1 -> 19
A21: of:=[Sheet2.A20] -> 2039 | C21: of:=ORG.OPENOFFICE.ISLEAPYEAR([Sheet1.D21]) -> 0 | D21: of:=WEEKDAY(DATE([Sheet1.A21];1;1)) -> 7 | G21: of:=[.H21]-[Sheet1.F21] -> 210 | H21: of:=DATE([Sheet1.A21];12;25) -> 2039-12-25 | K21: t
A22: of:=[Sheet2.A21] -> 2040 | C22: of:=ORG.OPENOFFICE.ISLEAPYEAR([Sheet1.D22]) -> 1 | D22: of:=WEEKDAY(DATE([Sheet1.A22];1;1)) -> 1 | G22: of:=[.H22]-[Sheet1.F22] -> 219 | H22: of:=DATE([Sheet1.A22];12;25) -> 2040-12-25 | K22: u
A23: of:=[Sheet2.A22] -> 2041 | C23: of:=ORG.OPENOFFICE.ISLEAPYEAR([Sheet1.D23]) -> 0 | D23: of:=WEEKDAY(DATE([Sheet1.A23];1;1)) -> 3 | G23: of:=[.H23]-[Sheet1.F23] -> 199 | H23: of:=DATE([Sheet1.A23];12;25) -> 2041-12-25 | K23: v
A24: of:=[Sheet2.A23] -> 2042 | C24: of:=ORG.OPENOFFICE.ISLEAPYEAR([Sheet1.D24]) -> 0 | D24: of:=WEEKDAY(DATE([Sheet1.A24];1;1)) -> 4 | G24: of:=[.H24]-[Sheet1.F24] -> 214 | H24: of:=DATE([Sheet1.A24];12;25) -> 2042-12-25 | K24: A
A25: of:=[Sheet2.A24] -> 2043 | C25: of:=ORG.OPENOFFICE.ISLEAPYEAR([Sheet1.D25]) -> 0 | D25: of:=WEEKDAY(DATE([Sheet1.A25];1;1)) -> 5 | G25: of:=[.H25]-[Sheet1.F25] -> 222 | H25: of:=DATE([Sheet1.A25];12;25) -> 2043-12-25 | K25: B
A26: of:=[Sheet2.A25] -> 2044 | C26: of:=ORG.OPENOFFICE.ISLEAPYEAR([Sheet1.D26]) -> 1 | D26: of:=WEEKDAY(DATE([Sheet1.A26];1;1)) -> 6 | G26: of:=[.H26]-[Sheet1.F26] -> 203 | H26: of:=DATE([Sheet1.A26];12;25) -> 2044-12-25 | K26: C
A27: of:=[Sheet2.A26] -> 2045 | C27: of:=ORG.OPENOFFICE.ISLEAPYEAR([Sheet1.D27]) -> 0 | D27: of:=WEEKDAY(DATE([Sheet1.A27];1;1)) -> 1 | G27: of:=[.H27]-[Sheet1.F27] -> 211 | H27: of:=DATE([Sheet1.A27];12;25) -> 2045-12-25 | K27: D
A28: of:=[Sheet2.A27] -> 2046 | C28: of:=ORG.OPENOFFICE.ISLEAPYEAR([Sheet1.D28]) -> 0 | D28: of:=WEEKDAY(DATE([Sheet1.A28];1;1)) -> 2 | G28: of:=[.H28]-[Sheet1.F28] -> 226 | H28: of:=DATE([Sheet1.A28];12;25) -> 2046-12-25 | K28: E
A29: of:=[Sheet2.A28] -> 2047 | C29: of:=ORG.OPENOFFICE.ISLEAPYEAR([Sheet1.D29]) -> 0 | D29: of:=WEEKDAY(DATE([Sheet1.A29];1;1)) -> 3 | G29: of:=[.H29]-[Sheet1.F29] -> 206 | H29: of:=DATE([Sheet1.A29];12;25) -> 2047-12-25 | K29: F
A30: of:=[Sheet2.A29] -> 2048 | C30: of:=ORG.OPENOFFICE.ISLEAPYEAR([Sheet1.D30]) -> 1 | D30: of:=WEEKDAY(DATE([Sheet1.A30];1;1)) -> 4 | G30: of:=[.H30]-[Sheet1.F30] -> 215 | H30: of:=DATE([Sheet1.A30];12;25) -> 2048-12-25 | K30: F
A31: of:=[Sheet2.A30] -> 2049 | C31: of:=ORG.OPENOFFICE.ISLEAPYEAR([Sheet1.D31]) -> 0 | D31: of:=WEEKDAY(DATE([Sheet1.A31];1;1)) -> 6 | G31: of:=[.H31]-[Sheet1.F31] -> 202 | H31: of:=DATE([Sheet1.A31];12;25) -> 2049-12-25 | K31: G
A32: of:=[Sheet2.A31] -> 2050 | C32: of:=ORG.OPENOFFICE.ISLEAPYEAR([Sheet1.D32]) -> 0 | D32: of:=WEEKDAY(DATE([Sheet1.A32];1;1)) -> 7 | G32: of:=[.H32]-[Sheet1.F32] -> 210 | H32: of:=DATE([Sheet1.A32];12;25) -> 2050-12-25 | K32: H
A33: of:=[Sheet2.A32] -> 2051 | C33: of:=ORG.OPENOFFICE.ISLEAPYEAR([Sheet1.D33]) -> 0 | D33: of:=WEEKDAY(DATE([Sheet1.A33];1;1)) -> 1 | G33: of:=[.H33]-[Sheet1.F33] -> 218 | H33: of:=DATE([Sheet1.A33];12;25) -> 2051-12-25 | K33: M
A34: of:=[Sheet2.A33] -> 2052 | C34: of:=ORG.OPENOFFICE.ISLEAPYEAR([Sheet1.D34]) -> 1 | D34: of:=WEEKDAY(DATE([Sheet1.A34];1;1)) -> 2 | G34: of:=[.H34]-[Sheet1.F34] -> 199 | H34: of:=DATE([Sheet1.A34];12;25) -> 2052-12-25 | K34: N
A35: of:=[Sheet2.A34] -> 2053 | C35: of:=ORG.OPENOFFICE.ISLEAPYEAR([Sheet1.D35]) -> 0 | D35: of:=WEEKDAY(DATE([Sheet1.A35];1;1)) -> 4 | G35: of:=[.H35]-[Sheet1.F35] -> 214 | H35: of:=DATE([Sheet1.A35];12;25) -> 2053-12-25 | K35: P
A36: of:=[Sheet2.A35] -> 2054 | C36: of:=ORG.OPENOFFICE.ISLEAPYEAR([Sheet1.D36]) -> 0 | D36: of:=WEEKDAY(DATE([Sheet1.A36];1;1)) -> 5 | G36: of:=[.H36]-[Sheet1.F36] -> 222 | H36: of:=DATE([Sheet1.A36];12;25) -> 2054-12-25
A37: of:=[Sheet2.A36] -> 2055 | C37: of:=ORG.OPENOFFICE.ISLEAPYEAR([Sheet1.D37]) -> 0 | D37: of:=WEEKDAY(DATE([Sheet1.A37];1;1)) -> 6 | G37: of:=[.H37]-[Sheet1.F37] -> 202 | H37: of:=DATE([Sheet1.A37];12;25) -> 2055-12-25
A38: of:=[Sheet2.A37] -> 2056 | C38: of:=ORG.OPENOFFICE.ISLEAPYEAR([Sheet1.D38]) -> 1 | D38: of:=WEEKDAY(DATE([Sheet1.A38];1;1)) -> 7 | G38: of:=[.H38]-[Sheet1.F38] -> 218 | H38: of:=DATE([Sheet1.A38];12;25) -> 2056-12-25
A39: of:=[Sheet2.A38] -> 2057 | C39: of:=ORG.OPENOFFICE.ISLEAPYEAR([Sheet1.D39]) -> 0 | D39: of:=WEEKDAY(DATE([Sheet1.A39];1;1)) -> 2 | G39: of:=[.H39]-[Sheet1.F39] -> 198 | H39: of:=DATE([Sheet1.A39];12;25) -> 2057-12-25
A40: of:=[Sheet2.A39] -> 2058 | C40: of:=ORG.OPENOFFICE.ISLEAPYEAR([Sheet1.D40]) -> 0 | D40: of:=WEEKDAY(DATE([Sheet1.A40];1;1)) -> 3 | G40: of:=[.H40]-[Sheet1.F40] -> 206 | H40: of:=DATE([Sheet1.A40];12;25) -> 2058-12-25
A41: of:=[Sheet2.A40] -> 2059 | C41: of:=ORG.OPENOFFICE.ISLEAPYEAR([Sheet1.D41]) -> 0 | D41: of:=WEEKDAY(DATE([Sheet1.A41];1;1)) -> 4 | G41: of:=[.H41]-[Sheet1.F41] -> 221 | H41: of:=DATE([Sheet1.A41];12;25) -> 2059-12-25