Sheet: Sheet1
A1: Year of our Lord | B1: Septuagesima Sunday | C1: Ash Wednesday | D1: Easter Sunday | E1: Ascension Thursday | F1: Pentecost (Whit-Sunday) | G1: # of Sundays after Pentecost | H1: 1st Sunday of Advent | I1: Letters denoting Sundays | J1: Golden Number | K1: Epact | R1: Christmas | S1: Sundays | T1: Epacts | V1: Epacts
A2: of:=[Sheet2.A1] -> 2008 | B2: of:=[.D2]-63 -> 2008-01-20 | C2: of:=[.D2]-46 -> 2008-02-06 | D2: of:=[Sheet2.B1] -> 2008-03-23 | E2: of:=[.D2]+39 -> 2008-05-01 | F2: of:=[.D2]+49 -> 2008-05-11 | G2: of:=INT(([.Q2]-1)/7)-4 -> 28 | H2: of:=[.F2]+[.G2]*7+7 -> 2008-11-30 | I2: of:=OFFSET([.$S$1];[.N2];0) & IF([.M2];" " & OFFSET([.$S$1];[.N2]+1;0);"") -> f e | J2: of:=MOD([.A2];19)+1 -> 14 | K2: of:=OFFSET([.$T$1];[.J2];0) -> XXII (C) | M2: of:=ORG.OPENOFFICE.ISLEAPYEAR([.D2]) -> 1 | N2: of:=WEEKDAY(DATE([.A2];1;1)) -> 3 | Q2: of:=[.R2]-[.F2] -> 228 | R2: of:=DATE([.A2];12;25) -> 2008-12-25 | S2: A | T2: of:=[.W2] & " (" & [.V2] & ")" -> XXIX (N) | U2: a | V2: N | W2: XXIX | X2: 1
A3: of:=[Sheet2.A2] -> 2009 | B3: of:=[.D3]-63 -> 2009-02-08 | C3: of:=[.D3]-46 -> 2009-02-25 | D3: of:=[Sheet2.B2] -> 2009-04-12 | E3: of:=[.D3]+39 -> 2009-05-21 | F3: of:=[.D3]+49 -> 2009-05-31 | G3: of:=INT(([.Q3]-1)/7)-4 -> 25 | H3: of:=[.F3]+[.G3]*7+7 -> 2009-11-29 | I3: of:=OFFSET([.$S$1];[.N3];0) & IF([.M3];" " & OFFSET([.$S$1];[.N3]+1;0);"") -> d | J3: of:=MOD([.A3];19)+1 -> 15 | K3: of:=OFFSET([.$T$1];[.J3];0) -> III (c) | M3: of:=ORG.OPENOFFICE.ISLEAPYEAR([.D3]) -> 0 | N3: of:=WEEKDAY(DATE([.A3];1;1)) -> 5 | Q3: of:=[.R3]-[.F3] -> 208 | R3: of:=DATE([.A3];12;25) -> 2009-12-25 | S3: g | T3: of:=[.W3] & " (" & [.V3] & ")" -> X (k) | U3: b | V3: k | W3: X | X3: of:=[.X2]+1 -> 2
A4: of:=[Sheet2.A3] -> 2010 | B4: of:=[.D4]-63 -> 2010-01-31 | C4: of:=[.D4]-46 -> 2010-02-17 | D4: of:=[Sheet2.B3] -> 2010-04-04 | E4: of:=[.D4]+39 -> 2010-05-13 | F4: of:=[.D4]+49 -> 2010-05-23 | G4: of:=INT(([.Q4]-1)/7)-4 -> 26 | H4: of:=[.F4]+[.G4]*7+7 -> 2010-11-28 | I4: of:=OFFSET([.$S$1];[.N4];0) & IF([.M4];" " & OFFSET([.$S$1];[.N4]+1;0);"") -> c | J4: of:=MOD([.A4];19)+1 -> 16 | K4: of:=OFFSET([.$T$1];[.J4];0) -> XIV (p) | M4: of:=ORG.OPENOFFICE.ISLEAPYEAR([.D4]) -> 0 | N4: of:=WEEKDAY(DATE([.A4];1;1)) -> 6 | Q4: of:=[.R4]-[.F4] -> 216 | R4: of:=DATE([.A4];12;25) -> 2010-12-25 | S4: f | T4: of:=[.W4] & " (" & [.V4] & ")" -> XXI (B) | U4: c | V4: B | W4: XXI | X4: of:=[.X3]+1 -> 3
A5: of:=[Sheet2.A4] -> 2011 | B5: of:=[.D5]-63 -> 2011-02-20 | C5: of:=[.D5]-46 -> 2011-03-09 | D5: of:=[Sheet2.B4] -> 2011-04-24 | E5: of:=[.D5]+39 -> 2011-06-02 | F5: of:=[.D5]+49 -> 2011-06-12 | G5: of:=INT(([.Q5]-1)/7)-4 -> 23 | H5: of:=[.F5]+[.G5]*7+7 -> 2011-11-27 | I5: of:=OFFSET([.$S$1];[.N5];0) & IF([.M5];" " & OFFSET([.$S$1];[.N5]+1;0);"") -> b | J5: of:=MOD([.A5];19)+1 -> 17 | K5: of:=OFFSET([.$T$1];[.J5];0) -> 25 (F) | M5: of:=ORG.OPENOFFICE.ISLEAPYEAR([.D5]) -> 0 | N5: of:=WEEKDAY(DATE([.A5];1;1)) -> 7 | Q5: of:=[.R5]-[.F5] -> 196 | R5: of:=DATE([.A5];12;25) -> 2011-12-25 | S5: e | T5: of:=[.W5] & " (" & [.V5] & ")" -> II (b) | U5: d | V5: b | W5: II | X5: of:=[.X4]+1 -> 4
A6: of:=[Sheet2.A5] -> 2012 | B6: of:=[.D6]-63 -> 2012-02-05 | C6: of:=[.D6]-46 -> 2012-02-22 | D6: of:=[Sheet2.B5] -> 2012-04-08 | E6: of:=[.D6]+39 -> 2012-05-17 | F6: of:=[.D6]+49 -> 2012-05-27 | G6: of:=INT(([.Q6]-1)/7)-4 -> 26 | H6: of:=[.F6]+[.G6]*7+7 -> 2012-12-02 | I6: of:=OFFSET([.$S$1];[.N6];0) & IF([.M6];" " & OFFSET([.$S$1];[.N6]+1;0);"") -> A g | J6: of:=MOD([.A6];19)+1 -> 18 | K6: of:=OFFSET([.$T$1];[.J6];0) -> VI (f) | M6: of:=ORG.OPENOFFICE.ISLEAPYEAR([.D6]) -> 1 | N6: of:=WEEKDAY(DATE([.A6];1;1)) -> 1 | Q6: of:=[.R6]-[.F6] -> 212 | R6: of:=DATE([.A6];12;25) -> 2012-12-25 | S6: d | T6: of:=[.W6] & " (" & [.V6] & ")" -> XIII (n) | U6: e | V6: n | W6: XIII | X6: of:=[.X5]+1 -> 5
A7: of:=[Sheet2.A6] -> 2013 | B7: of:=[.D7]-63 -> 2013-01-27 | C7: of:=[.D7]-46 -> 2013-02-13 | D7: of:=[Sheet2.B6] -> 2013-03-31 | E7: of:=[.D7]+39 -> 2013-05-09 | F7: of:=[.D7]+49 -> 2013-05-19 | G7: of:=INT(([.Q7]-1)/7)-4 -> 27 | H7: of:=[.F7]+[.G7]*7+7 -> 2013-12-01 | I7: of:=OFFSET([.$S$1];[.N7];0) & IF([.M7];" " & OFFSET([.$S$1];[.N7]+1;0);"") -> f | J7: of:=MOD([.A7];19)+1 -> 19 | K7: of:=OFFSET([.$T$1];[.J7];0) -> XVII (s) | M7: of:=ORG.OPENOFFICE.ISLEAPYEAR([.D7]) -> 0 | N7: of:=WEEKDAY(DATE([.A7];1;1)) -> 3 | Q7: of:=[.R7]-[.F7] -> 220 | R7: of:=DATE([.A7];12;25) -> 2013-12-25 | S7: c | T7: of:=[.W7] & " (" & [.V7] & ")" -> XXIV (E) | U7: f | V7: E | W7: XXIV | X7: of:=[.X6]+1 -> 6
A8: of:=[Sheet2.A7] -> 2014 | B8: of:=[.D8]-63 -> 2014-02-16 | C8: of:=[.D8]-46 -> 2014-03-05 | D8: of:=[Sheet2.B7] -> 2014-04-20 | E8: of:=[.D8]+39 -> 2014-05-29 | F8: of:=[.D8]+49 -> 2014-06-08 | G8: of:=INT(([.Q8]-1)/7)-4 -> 24 | H8: of:=[.F8]+[.G8]*7+7 -> 2014-11-30 | I8: of:=OFFSET([.$S$1];[.N8];0) & IF([.M8];" " & OFFSET([.$S$1];[.N8]+1;0);"") -> e | J8: of:=MOD([.A8];19)+1 -> 1 | K8: of:=OFFSET([.$T$1];[.J8];0) -> XXIX (N) | M8: of:=ORG.OPENOFFICE.ISLEAPYEAR([.D8]) -> 0 | N8: of:=WEEKDAY(DATE([.A8];1;1)) -> 4 | Q8: of:=[.R8]-[.F8] -> 200 | R8: of:=DATE([.A8];12;25) -> 2014-12-25 | S8: b | T8: of:=[.W8] & " (" & [.V8] & ")" -> V (e) | U8: g | V8: e | W8: V | X8: of:=[.X7]+1 -> 7
A9: of:=[Sheet2.A8] -> 2015 | B9: of:=[.D9]-63 -> 2015-02-01 | C9: of:=[.D9]-46 -> 2015-02-18 | D9: of:=[Sheet2.B8] -> 2015-04-05 | E9: of:=[.D9]+39 -> 2015-05-14 | F9: of:=[.D9]+49 -> 2015-05-24 | G9: of:=INT(([.Q9]-1)/7)-4 -> 26 | H9: of:=[.F9]+[.G9]*7+7 -> 2015-11-29 | I9: of:=OFFSET([.$S$1];[.N9];0) & IF([.M9];" " & OFFSET([.$S$1];[.N9]+1;0);"") -> d | J9: of:=MOD([.A9];19)+1 -> 2 | K9: of:=OFFSET([.$T$1];[.J9];0) -> X (k) | M9: of:=ORG.OPENOFFICE.ISLEAPYEAR([.D9]) -> 0 | N9: of:=WEEKDAY(DATE([.A9];1;1)) -> 5 | Q9: of:=[.R9]-[.F9] -> 215 | R9: of:=DATE([.A9];12;25) -> 2015-12-25 | S9: A | T9: of:=[.W9] & " (" & [.V9] & ")" -> XVI (r) | U9: h | V9: r | W9: XVI | X9: of:=[.X8]+1 -> 8
A10: of:=[Sheet2.A9] -> 2016 | B10: of:=[.D10]-63 -> 2016-01-24 | C10: of:=[.D10]-46 -> 2016-02-10 | D10: of:=[Sheet2.B9] -> 2016-03-27 | E10: of:=[.D10]+39 -> 2016-05-05 | F10: of:=[.D10]+49 -> 2016-05-15 | G10: of:=INT(([.Q10]-1)/7)-4 -> 27 | H10: of:=[.F10]+[.G10]*7+7 -> 2016-11-27 | I10: of:=OFFSET([.$S$1];[.N10];0) & IF([.M10];" " & OFFSET([.$S$1];[.N10]+1;0);"") -> c b | J10: of:=MOD([.A10];19)+1 -> 3 | K10: of:=OFFSET([.$T$1];[.J10];0) -> XXI (B) | M10: of:=ORG.OPENOFFICE.ISLEAPYEAR([.D10]) -> 1 | N10: of:=WEEKDAY(DATE([.A10];1;1)) -> 6 | Q10: of:=[.R10]-[.F10] -> 224 | R10: of:=DATE([.A10];12;25) -> 2016-12-25 | T10: of:=[.W10] & " (" & [.V10] & ")" -> XXVII (H) | U10: i | V10: H | W10: XXVII | X10: of:=[.X9]+1 -> 9
A11: of:=[Sheet2.A10] -> 2017 | B11: of:=[.D11]-63 -> 2017-02-12 | C11: of:=[.D11]-46 -> 2017-03-01 | D11: of:=[Sheet2.B10] -> 2017-04-16 | E11: of:=[.D11]+39 -> 2017-05-25 | F11: of:=[.D11]+49 -> 2017-06-04 | G11: of:=INT(([.Q11]-1)/7)-4 -> 25 | H11: of:=[.F11]+[.G11]*7+7 -> 2017-12-03 | I11: of:=OFFSET([.$S$1];[.N11];0) & IF([.M11];" " & OFFSET([.$S$1];[.N11]+1;0);"") -> A | J11: of:=MOD([.A11];19)+1 -> 4 | K11: of:=OFFSET([.$T$1];[.J11];0) -> II (b) | M11: of:=ORG.OPENOFFICE.ISLEAPYEAR([.D11]) -> 0 | N11: of:=WEEKDAY(DATE([.A11];1;1)) -> 1 | Q11: of:=[.R11]-[.F11] -> 204 | R11: of:=DATE([.A11];12;25) -> 2017-12-25 | T11: of:=[.W11] & " (" & [.V11] & ")" -> VIII (h) | U11: j | V11: h | W11: VIII | X11: of:=[.X10]+1 -> 10
A12: of:=[Sheet2.A11] -> 2018 | B12: of:=[.D12]-63 -> 2018-01-28 | C12: of:=[.D12]-46 -> 2018-02-14 | D12: of:=[Sheet2.B11] -> 2018-04-01 | E12: of:=[.D12]+39 -> 2018-05-10 | F12: of:=[.D12]+49 -> 2018-05-20 | G12: of:=INT(([.Q12]-1)/7)-4 -> 27 | H12: of:=[.F12]+[.G12]*7+7 -> 2018-12-02 | I12: of:=OFFSET([.$S$1];[.N12];0) & IF([.M12];" " & OFFSET([.$S$1];[.N12]+1;0);"") -> g | J12: of:=MOD([.A12];19)+1 -> 5 | K12: of:=OFFSET([.$T$1];[.J12];0) -> XIII (n) | M12: of:=ORG.OPENOFFICE.ISLEAPYEAR([.D12]) -> 0 | N12: of:=WEEKDAY(DATE([.A12];1;1)) -> 2 | Q12: of:=[.R12]-[.F12] -> 219 | R12: of:=DATE([.A12];12;25) -> 2018-12-25 | T12: of:=[.W12] & " (" & [.V12] & ")" -> XIX (u) | U12: k | V12: u | W12: XIX | X12: of:=[.X11]+1 -> 11
A13: of:=[Sheet2.A12] -> 2019 | B13: of:=[.D13]-63 -> 2019-02-17 | C13: of:=[.D13]-46 -> 2019-03-06 | D13: of:=[Sheet2.B12] -> 2019-04-21 | E13: of:=[.D13]+39 -> 2019-05-30 | F13: of:=[.D13]+49 -> 2019-06-09 | G13: of:=INT(([.Q13]-1)/7)-4 -> 24 | H13: of:=[.F13]+[.G13]*7+7 -> 2019-12-01 | I13: of:=OFFSET([.$S$1];[.N13];0) & IF([.M13];" " & OFFSET([.$S$1];[.N13]+1;0);"") -> f | J13: of:=MOD([.A13];19)+1 -> 6 | K13: of:=OFFSET([.$T$1];[.J13];0) -> XXIV (E) | M13: of:=ORG.OPENOFFICE.ISLEAPYEAR([.D13]) -> 0 | N13: of:=WEEKDAY(DATE([.A13];1;1)) -> 3 | Q13: of:=[.R13]-[.F13] -> 199 | R13: of:=DATE([.A13];12;25) -> 2019-12-25 | T13: of:=[.W13] & " (" & [.V13] & ")" -> * (P) | U13: l | V13: P | W13: * | X13: of:=[.X12]+1 -> 12
A14: of:=[Sheet2.A13] -> 2020 | B14: of:=[.D14]-63 -> 2020-02-09 | C14: of:=[.D14]-46 -> 2020-02-26 | D14: of:=[Sheet2.B13] -> 2020-04-12 | E14: of:=[.D14]+39 -> 2020-05-21 | F14: of:=[.D14]+49 -> 2020-05-31 | G14: of:=INT(([.Q14]-1)/7)-4 -> 25 | H14: of:=[.F14]+[.G14]*7+7 -> 2020-11-29 | I14: of:=OFFSET([.$S$1];[.N14];0) & IF([.M14];" " & OFFSET([.$S$1];[.N14]+1;0);"") -> e d | J14: of:=MOD([.A14];19)+1 -> 7 | K14: of:=OFFSET([.$T$1];[.J14];0) -> V (e) | M14: of:=ORG.OPENOFFICE.ISLEAPYEAR([.D14]) -> 1 | N14: of:=WEEKDAY(DATE([.A14];1;1)) -> 4 | Q14: of:=[.R14]-[.F14] -> 208 | R14: of:=DATE([.A14];12;25) -> 2020-12-25 | T14: of:=[.W14] & " (" & [.V14] & ")" -> XI (l) | U14: m | V14: l | W14: XI | X14: of:=[.X13]+1 -> 13
A15: of:=[Sheet2.A14] -> 2021 | B15: of:=[.D15]-63 -> 2021-01-31 | C15: of:=[.D15]-46 -> 2021-02-17 | D15: of:=[Sheet2.B14] -> 2021-04-04 | E15: of:=[.D15]+39 -> 2021-05-13 | F15: of:=[.D15]+49 -> 2021-05-23 | G15: of:=INT(([.Q15]-1)/7)-4 -> 26 | H15: of:=[.F15]+[.G15]*7+7 -> 2021-11-28 | I15: of:=OFFSET([.$S$1];[.N15];0) & IF([.M15];" " & OFFSET([.$S$1];[.N15]+1;0);"") -> c | J15: of:=MOD([.A15];19)+1 -> 8 | K15: of:=OFFSET([.$T$1];[.J15];0) -> XVI (r) | M15: of:=ORG.OPENOFFICE.ISLEAPYEAR([.D15]) -> 0 | N15: of:=WEEKDAY(DATE([.A15];1;1)) -> 6 | Q15: of:=[.R15]-[.F15] -> 216 | R15: of:=DATE([.A15];12;25) -> 2021-12-25 | T15: of:=[.W15] & " (" & [.V15] & ")" -> XXII (C) | U15: n | V15: C | W15: XXII | X15: of:=[.X14]+1 -> 14
A16: of:=[Sheet2.A15] -> 2022 | B16: of:=[.D16]-63 -> 2022-02-13 | C16: of:=[.D16]-46 -> 2022-03-02 | D16: of:=[Sheet2.B15] -> 2022-04-17 | E16: of:=[.D16]+39 -> 2022-05-26 | F16: of:=[.D16]+49 -> 2022-06-05 | G16: of:=INT(([.Q16]-1)/7)-4 -> 24 | H16: of:=[.F16]+[.G16]*7+7 -> 2022-11-27 | I16: of:=OFFSET([.$S$1];[.N16];0) & IF([.M16];" " & OFFSET([.$S$1];[.N16]+1;0);"") -> b | J16: of:=MOD([.A16];19)+1 -> 9 | K16: of:=OFFSET([.$T$1];[.J16];0) -> XXVII (H) | M16: of:=ORG.OPENOFFICE.ISLEAPYEAR([.D16]) -> 0 | N16: of:=WEEKDAY(DATE([.A16];1;1)) -> 7 | Q16: of:=[.R16]-[.F16] -> 203 | R16: of:=DATE([.A16];12;25) -> 2022-12-25 | T16: of:=[.W16] & " (" & [.V16] & ")" -> III (c) | U16: o | V16: c | W16: III | X16: of:=[.X15]+1 -> 15
A17: of:=[Sheet2.A16] -> 2023 | B17: of:=[.D17]-63 -> 2023-02-05 | C17: of:=[.D17]-46 -> 2023-02-22 | D17: of:=[Sheet2.B16] -> 2023-04-09 | E17: of:=[.D17]+39 -> 2023-05-18 | F17: of:=[.D17]+49 -> 2023-05-28 | G17: of:=INT(([.Q17]-1)/7)-4 -> 26 | H17: of:=[.F17]+[.G17]*7+7 -> 2023-12-03 | I17: of:=OFFSET([.$S$1];[.N17];0) & IF([.M17];" " & OFFSET([.$S$1];[.N17]+1;0);"") -> A | J17: of:=MOD([.A17];19)+1 -> 10 | K17: of:=OFFSET([.$T$1];[.J17];0) -> VIII (h) | M17: of:=ORG.OPENOFFICE.ISLEAPYEAR([.D17]) -> 0 | N17: of:=WEEKDAY(DATE([.A17];1;1)) -> 1 | Q17: of:=[.R17]-[.F17] -> 211 | R17: of:=DATE([.A17];12;25) -> 2023-12-25 | T17: of:=[.W17] & " (" & [.V17] & ")" -> XIV (p) | U17: p | V17: p | W17: XIV | X17: of:=[.X16]+1 -> 16
A18: of:=[Sheet2.A17] -> 2024 | B18: of:=[.D18]-63 -> 2024-01-28 | C18: of:=[.D18]-46 -> 2024-02-14 | D18: of:=[Sheet2.B17] -> 2024-03-31 | E18: of:=[.D18]+39 -> 2024-05-09 | F18: of:=[.D18]+49 -> 2024-05-19 | G18: of:=INT(([.Q18]-1)/7)-4 -> 27 | H18: of:=[.F18]+[.G18]*7+7 -> 2024-12-01 | I18: of:=OFFSET([.$S$1];[.N18];0) & IF([.M18];" " & OFFSET([.$S$1];[.N18]+1;0);"") -> g f | J18: of:=MOD([.A18];19)+1 -> 11 | K18: of:=OFFSET([.$T$1];[.J18];0) -> XIX (u) | M18: of:=ORG.OPENOFFICE.ISLEAPYEAR([.D18]) -> 1 | N18: of:=WEEKDAY(DATE([.A18];1;1)) -> 2 | Q18: of:=[.R18]-[.F18] -> 220 | R18: of:=DATE([.A18];12;25) -> 2024-12-25 | T18: of:=[.W18] & " (" & [.V18] & ")" -> 25 (F) | U18: q | V18: F | W18: 25 | X18: of:=[.X17]+1 -> 17
A19: of:=[Sheet2.A18] -> 2025 | B19: of:=[.D19]-63 -> 2025-02-16 | C19: of:=[.D19]-46 -> 2025-03-05 | D19: of:=[Sheet2.B18] -> 2025-04-20 | E19: of:=[.D19]+39 -> 2025-05-29 | F19: of:=[.D19]+49 -> 2025-06-08 | G19: of:=INT(([.Q19]-1)/7)-4 -> 24 | H19: of:=[.F19]+[.G19]*7+7 -> 2025-11-30 | I19: of:=OFFSET([.$S$1];[.N19];0) & IF([.M19];" " & OFFSET([.$S$1];[.N19]+1;0);"") -> e | J19: of:=MOD([.A19];19)+1 -> 12 | K19: of:=OFFSET([.$T$1];[.J19];0) -> * (P) | M19: of:=ORG.OPENOFFICE.ISLEAPYEAR([.D19]) -> 0 | N19: of:=WEEKDAY(DATE([.A19];1;1)) -> 4 | Q19: of:=[.R19]-[.F19] -> 200 | R19: of:=DATE([.A19];12;25) -> 2025-12-25 | T19: of:=[.W19] & " (" & [.V19] & ")" -> VI (f) | U19: r | V19: f | W19: VI | X19: of:=[.X18]+1 -> 18
A20: of:=[Sheet2.A19] -> 2026 | B20: of:=[.D20]-63 -> 2026-02-01 | C20: of:=[.D20]-46 -> 2026-02-18 | D20: of:=[Sheet2.B19] -> 2026-04-05 | E20: of:=[.D20]+39 -> 2026-05-14 | F20: of:=[.D20]+49 -> 2026-05-24 | G20: of:=INT(([.Q20]-1)/7)-4 -> 26 | H20: of:=[.F20]+[.G20]*7+7 -> 2026-11-29 | I20: of:=OFFSET([.$S$1];[.N20];0) & IF([.M20];" " & OFFSET([.$S$1];[.N20]+1;0);"") -> d | J20: of:=MOD([.A20];19)+1 -> 13 | K20: of:=OFFSET([.$T$1];[.J20];0) -> XI (l) | M20: of:=ORG.OPENOFFICE.ISLEAPYEAR([.D20]) -> 0 | N20: of:=WEEKDAY(DATE([.A20];1;1)) -> 5 | Q20: of:=[.R20]-[.F20] -> 215 | R20: of:=DATE([.A20];12;25) -> 2026-12-25 | T20: of:=[.W20] & " (" & [.V20] & ")" -> XVII (s) | U20: s | V20: s | W20: XVII | X20: of:=[.X19]+1 -> 19
A21: of:=[Sheet2.A20] -> 2027 | B21: of:=[.D21]-63 -> 2027-01-24 | C21: of:=[.D21]-46 -> 2027-02-10 | D21: of:=[Sheet2.B20] -> 2027-03-28 | E21: of:=[.D21]+39 -> 2027-05-06 | F21: of:=[.D21]+49 -> 2027-05-16 | G21: of:=INT(([.Q21]-1)/7)-4 -> 27 | H21: of:=[.F21]+[.G21]*7+7 -> 2027-11-28 | I21: of:=OFFSET([.$S$1];[.N21];0) & IF([.M21];" " & OFFSET([.$S$1];[.N21]+1;0);"") -> c | J21: of:=MOD([.A21];19)+1 -> 14 | K21: of:=OFFSET([.$T$1];[.J21];0) -> XXII (C) | M21: of:=ORG.OPENOFFICE.ISLEAPYEAR([.D21]) -> 0 | N21: of:=WEEKDAY(DATE([.A21];1;1)) -> 6 | Q21: of:=[.R21]-[.F21] -> 223 | R21: of:=DATE([.A21];12;25) -> 2027-12-25 | U21: t
A22: of:=[Sheet2.A21] -> 2028 | B22: of:=[.D22]-63 -> 2028-02-13 | C22: of:=[.D22]-46 -> 2028-03-01 | D22: of:=[Sheet2.B21] -> 2028-04-16 | E22: of:=[.D22]+39 -> 2028-05-25 | F22: of:=[.D22]+49 -> 2028-06-04 | G22: of:=INT(([.Q22]-1)/7)-4 -> 25 | H22: of:=[.F22]+[.G22]*7+7 -> 2028-12-03 | I22: of:=OFFSET([.$S$1];[.N22];0) & IF([.M22];" " & OFFSET([.$S$1];[.N22]+1;0);"") -> b A | J22: of:=MOD([.A22];19)+1 -> 15 | K22: of:=OFFSET([.$T$1];[.J22];0) -> III (c) | M22: of:=ORG.OPENOFFICE.ISLEAPYEAR([.D22]) -> 1 | N22: of:=WEEKDAY(DATE([.A22];1;1)) -> 7 | Q22: of:=[.R22]-[.F22] -> 204 | R22: of:=DATE([.A22];12;25) -> 2028-12-25 | U22: u
A23: of:=[Sheet2.A22] -> 2029 | B23: of:=[.D23]-63 -> 2029-01-28 | C23: of:=[.D23]-46 -> 2029-02-14 | D23: of:=[Sheet2.B22] -> 2029-04-01 | E23: of:=[.D23]+39 -> 2029-05-10 | F23: of:=[.D23]+49 -> 2029-05-20 | G23: of:=INT(([.Q23]-1)/7)-4 -> 27 | H23: of:=[.F23]+[.G23]*7+7 -> 2029-12-02 | I23: of:=OFFSET([.$S$1];[.N23];0) & IF([.M23];" " & OFFSET([.$S$1];[.N23]+1;0);"") -> g | J23: of:=MOD([.A23];19)+1 -> 16 | K23: of:=OFFSET([.$T$1];[.J23];0) -> XIV (p) | M23: of:=ORG.OPENOFFICE.ISLEAPYEAR([.D23]) -> 0 | N23: of:=WEEKDAY(DATE([.A23];1;1)) -> 2 | Q23: of:=[.R23]-[.F23] -> 219 | R23: of:=DATE([.A23];12;25) -> 2029-12-25 | U23: v
A24: of:=[Sheet2.A23] -> 2030 | B24: of:=[.D24]-63 -> 2030-02-17 | C24: of:=[.D24]-46 -> 2030-03-06 | D24: of:=[Sheet2.B23] -> 2030-04-21 | E24: of:=[.D24]+39 -> 2030-05-30 | F24: of:=[.D24]+49 -> 2030-06-09 | G24: of:=INT(([.Q24]-1)/7)-4 -> 24 | H24: of:=[.F24]+[.G24]*7+7 -> 2030-12-01 | I24: of:=OFFSET([.$S$1];[.N24];0) & IF([.M24];" " & OFFSET([.$S$1];[.N24]+1;0);"") -> f | J24: of:=MOD([.A24];19)+1 -> 17 | K24: of:=OFFSET([.$T$1];[.J24];0) -> 25 (F) | M24: of:=ORG.OPENOFFICE.ISLEAPYEAR([.D24]) -> 0 | N24: of:=WEEKDAY(DATE([.A24];1;1)) -> 3 | Q24: of:=[.R24]-[.F24] -> 199 | R24: of:=DATE([.A24];12;25) -> 2030-12-25 | U24: A
A25: of:=[Sheet2.A24] -> 2031 | B25: of:=[.D25]-63 -> 2031-02-09 | C25: of:=[.D25]-46 -> 2031-02-26 | D25: of:=[Sheet2.B24] -> 2031-04-13 | E25: of:=[.D25]+39 -> 2031-05-22 | F25: of:=[.D25]+49 -> 2031-06-01 | G25: of:=INT(([.Q25]-1)/7)-4 -> 25 | H25: of:=[.F25]+[.G25]*7+7 -> 2031-11-30 | I25: of:=OFFSET([.$S$1];[.N25];0) & IF([.M25];" " & OFFSET([.$S$1];[.N25]+1;0);"") -> e | J25: of:=MOD([.A25];19)+1 -> 18 | K25: of:=OFFSET([.$T$1];[.J25];0) -> VI (f) | M25: of:=ORG.OPENOFFICE.ISLEAPYEAR([.D25]) -> 0 | N25: of:=WEEKDAY(DATE([.A25];1;1)) -> 4 | Q25: of:=[.R25]-[.F25] -> 207 | R25: of:=DATE([.A25];12;25) -> 2031-12-25 | U25: B
A26: of:=[Sheet2.A25] -> 2032 | B26: of:=[.D26]-63 -> 2032-01-25 | C26: of:=[.D26]-46 -> 2032-02-11 | D26: of:=[Sheet2.B25] -> 2032-03-28 | E26: of:=[.D26]+39 -> 2032-05-06 | F26: of:=[.D26]+49 -> 2032-05-16 | G26: of:=INT(([.Q26]-1)/7)-4 -> 27 | H26: of:=[.F26]+[.G26]*7+7 -> 2032-11-28 | I26: of:=OFFSET([.$S$1];[.N26];0) & IF([.M26];" " & OFFSET([.$S$1];[.N26]+1;0);"") -> d c | J26: of:=MOD([.A26];19)+1 -> 19 | K26: of:=OFFSET([.$T$1];[.J26];0) -> XVII (s) | M26: of:=ORG.OPENOFFICE.ISLEAPYEAR([.D26]) -> 1 | N26: of:=WEEKDAY(DATE([.A26];1;1)) -> 5 | Q26: of:=[.R26]-[.F26] -> 223 | R26: of:=DATE([.A26];12;25) -> 2032-12-25 | U26: C
A27: of:=[Sheet2.A26] -> 2033 | B27: of:=[.D27]-63 -> 2033-02-13 | C27: of:=[.D27]-46 -> 2033-03-02 | D27: of:=[Sheet2.B26] -> 2033-04-17 | E27: of:=[.D27]+39 -> 2033-05-26 | F27: of:=[.D27]+49 -> 2033-06-05 | G27: of:=INT(([.Q27]-1)/7)-4 -> 24 | H27: of:=[.F27]+[.G27]*7+7 -> 2033-11-27 | I27: of:=OFFSET([.$S$1];[.N27];0) & IF([.M27];" " & OFFSET([.$S$1];[.N27]+1;0);"") -> b | J27: of:=MOD([.A27];19)+1 -> 1 | K27: of:=OFFSET([.$T$1];[.J27];0) -> XXIX (N) | M27: of:=ORG.OPENOFFICE.ISLEAPYEAR([.D27]) -> 0 | N27: of:=WEEKDAY(DATE([.A27];1;1)) -> 7 | Q27: of:=[.R27]-[.F27] -> 203 | R27: of:=DATE([.A27];12;25) -> 2033-12-25 | U27: D
A28: of:=[Sheet2.A27] -> 2034 | B28: of:=[.D28]-63 -> 2034-02-05 | C28: of:=[.D28]-46 -> 2034-02-22 | D28: of:=[Sheet2.B27] -> 2034-04-09 | E28: of:=[.D28]+39 -> 2034-05-18 | F28: of:=[.D28]+49 -> 2034-05-28 | G28: of:=INT(([.Q28]-1)/7)-4 -> 26 | H28: of:=[.F28]+[.G28]*7+7 -> 2034-12-03 | I28: of:=OFFSET([.$S$1];[.N28];0) & IF([.M28];" " & OFFSET([.$S$1];[.N28]+1;0);"") -> A | J28: of:=MOD([.A28];19)+1 -> 2 | K28: of:=OFFSET([.$T$1];[.J28];0) -> X (k) | M28: of:=ORG.OPENOFFICE.ISLEAPYEAR([.D28]) -> 0 | N28: of:=WEEKDAY(DATE([.A28];1;1)) -> 1 | Q28: of:=[.R28]-[.F28] -> 211 | R28: of:=DATE([.A28];12;25) -> 2034-12-25 | U28: E
A29: of:=[Sheet2.A28] -> 2035 | B29: of:=[.D29]-63 -> 2035-01-21 | C29: of:=[.D29]-46 -> 2035-02-07 | D29: of:=[Sheet2.B28] -> 2035-03-25 | E29: of:=[.D29]+39 -> 2035-05-03 | F29: of:=[.D29]+49 -> 2035-05-13 | G29: of:=INT(([.Q29]-1)/7)-4 -> 28 | H29: of:=[.F29]+[.G29]*7+7 -> 2035-12-02 | I29: of:=OFFSET([.$S$1];[.N29];0) & IF([.M29];" " & OFFSET([.$S$1];[.N29]+1;0);"") -> g | J29: of:=MOD([.A29];19)+1 -> 3 | K29: of:=OFFSET([.$T$1];[.J29];0) -> XXI (B) | M29: of:=ORG.OPENOFFICE.ISLEAPYEAR([.D29]) -> 0 | N29: of:=WEEKDAY(DATE([.A29];1;1)) -> 2 | Q29: of:=[.R29]-[.F29] -> 226 | R29: of:=DATE([.A29];12;25) -> 2035-12-25 | U29: F
A30: of:=[Sheet2.A29] -> 2036 | B30: of:=[.D30]-63 -> 2036-02-10 | C30: of:=[.D30]-46 -> 2036-02-27 | D30: of:=[Sheet2.B29] -> 2036-04-13 | E30: of:=[.D30]+39 -> 2036-05-22 | F30: of:=[.D30]+49 -> 2036-06-01 | G30: of:=INT(([.Q30]-1)/7)-4 -> 25 | H30: of:=[.F30]+[.G30]*7+7 -> 2036-11-30 | I30: of:=OFFSET([.$S$1];[.N30];0) & IF([.M30];" " & OFFSET([.$S$1];[.N30]+1;0);"") -> f e | J30: of:=MOD([.A30];19)+1 -> 4 | K30: of:=OFFSET([.$T$1];[.J30];0) -> II (b) | M30: of:=ORG.OPENOFFICE.ISLEAPYEAR([.D30]) -> 1 | N30: of:=WEEKDAY(DATE([.A30];1;1)) -> 3 | Q30: of:=[.R30]-[.F30] -> 207 | R30: of:=DATE([.A30];12;25) -> 2036-12-25 | U30: F
A31: of:=[Sheet2.A30] -> 2037 | B31: of:=[.D31]-63 -> 2037-02-01 | C31: of:=[.D31]-46 -> 2037-02-18 | D31: of:=[Sheet2.B30] -> 2037-04-05 | E31: of:=[.D31]+39 -> 2037-05-14 | F31: of:=[.D31]+49 -> 2037-05-24 | G31: of:=INT(([.Q31]-1)/7)-4 -> 26 | H31: of:=[.F31]+[.G31]*7+7 -> 2037-11-29 | I31: of:=OFFSET([.$S$1];[.N31];0) & IF([.M31];" " & OFFSET([.$S$1];[.N31]+1;0);"") -> d | J31: of:=MOD([.A31];19)+1 -> 5 | K31: of:=OFFSET([.$T$1];[.J31];0) -> XIII (n) | M31: of:=ORG.OPENOFFICE.ISLEAPYEAR([.D31]) -> 0 | N31: of:=WEEKDAY(DATE([.A31];1;1)) -> 5 | Q31: of:=[.R31]-[.F31] -> 215 | R31: of:=DATE([.A31];12;25) -> 2037-12-25 | U31: G
A32: of:=[Sheet2.A31] -> 2038 | B32: of:=[.D32]-63 -> 2038-02-21 | C32: of:=[.D32]-46 -> 2038-03-10 | D32: of:=[Sheet2.B31] -> 2038-04-25 | E32: of:=[.D32]+39 -> 2038-06-03 | F32: of:=[.D32]+49 -> 2038-06-13 | G32: of:=INT(([.Q32]-1)/7)-4 -> 23 | H32: of:=[.F32]+[.G32]*7+7 -> 2038-11-28 | I32: of:=OFFSET([.$S$1];[.N32];0) & IF([.M32];" " & OFFSET([.$S$1];[.N32]+1;0);"") -> c | J32: of:=MOD([.A32];19)+1 -> 6 | K32: of:=OFFSET([.$T$1];[.J32];0) -> XXIV (E) | M32: of:=ORG.OPENOFFICE.ISLEAPYEAR([.D32]) -> 0 | N32: of:=WEEKDAY(DATE([.A32];1;1)) -> 6 | Q32: of:=[.R32]-[.F32] -> 195 | R32: of:=DATE([.A32];12;25) -> 2038-12-25 | U32: H
A33: of:=[Sheet2.A32] -> 2039 | B33: of:=[.D33]-63 -> 2039-02-06 | C33: of:=[.D33]-46 -> 2039-02-23 | D33: of:=[Sheet2.B32] -> 2039-04-10 | E33: of:=[.D33]+39 -> 2039-05-19 | F33: of:=[.D33]+49 -> 2039-05-29 | G33: of:=INT(([.Q33]-1)/7)-4 -> 25 | H33: of:=[.F33]+[.G33]*7+7 -> 2039-11-27 | I33: of:=OFFSET([.$S$1];[.N33];0) & IF([.M33];" " & OFFSET([.$S$1];[.N33]+1;0);"") -> b | J33: of:=MOD([.A33];19)+1 -> 7 | K33: of:=OFFSET([.$T$1];[.J33];0) -> V (e) | M33: of:=ORG.OPENOFFICE.ISLEAPYEAR([.D33]) -> 0 | N33: of:=WEEKDAY(DATE([.A33];1;1)) -> 7 | Q33: of:=[.R33]-[.F33] -> 210 | R33: of:=DATE([.A33];12;25) -> 2039-12-25 | U33: M
A34: of:=[Sheet2.A33] -> 2040 | B34: of:=[.D34]-63 -> 2040-01-29 | C34: of:=[.D34]-46 -> 2040-02-15 | D34: of:=[Sheet2.B33] -> 2040-04-01 | E34: of:=[.D34]+39 -> 2040-05-10 | F34: of:=[.D34]+49 -> 2040-05-20 | G34: of:=INT(([.Q34]-1)/7)-4 -> 27 | H34: of:=[.F34]+[.G34]*7+7 -> 2040-12-02 | I34: of:=OFFSET([.$S$1];[.N34];0) & IF([.M34];" " & OFFSET([.$S$1];[.N34]+1;0);"") -> A g | J34: of:=MOD([.A34];19)+1 -> 8 | K34: of:=OFFSET([.$T$1];[.J34];0) -> XVI (r) | M34: of:=ORG.OPENOFFICE.ISLEAPYEAR([.D34]) -> 1 | N34: of:=WEEKDAY(DATE([.A34];1;1)) -> 1 | Q34: of:=[.R34]-[.F34] -> 219 | R34: of:=DATE([.A34];12;25) -> 2040-12-25 | U34: N
A35: of:=[Sheet2.A34] -> 2041 | B35: of:=[.D35]-63 -> 2041-02-17 | C35: of:=[.D35]-46 -> 2041-03-06 | D35: of:=[Sheet2.B34] -> 2041-04-21 | E35: of:=[.D35]+39 -> 2041-05-30 | F35: of:=[.D35]+49 -> 2041-06-09 | G35: of:=INT(([.Q35]-1)/7)-4 -> 24 | H35: of:=[.F35]+[.G35]*7+7 -> 2041-12-01 | I35: of:=OFFSET([.$S$1];[.N35];0) & IF([.M35];" " & OFFSET([.$S$1];[.N35]+1;0);"") -> f | J35: of:=MOD([.A35];19)+1 -> 9 | K35: of:=OFFSET([.$T$1];[.J35];0) -> XXVII (H) | M35: of:=ORG.OPENOFFICE.ISLEAPYEAR([.D35]) -> 0 | N35: of:=WEEKDAY(DATE([.A35];1;1)) -> 3 | Q35: of:=[.R35]-[.F35] -> 199 | R35: of:=DATE([.A35];12;25) -> 2041-12-25 | U35: P
A36: of:=[Sheet2.A35] -> 2042 | B36: of:=[.D36]-63 -> 2042-02-02 | C36: of:=[.D36]-46 -> 2042-02-19 | D36: of:=[Sheet2.B35] -> 2042-04-06 | E36: of:=[.D36]+39 -> 2042-05-15 | F36: of:=[.D36]+49 -> 2042-05-25 | G36: of:=INT(([.Q36]-1)/7)-4 -> 26 | H36: of:=[.F36]+[.G36]*7+7 -> 2042-11-30 | I36: of:=OFFSET([.$S$1];[.N36];0) & IF([.M36];" " & OFFSET([.$S$1];[.N36]+1;0);"") -> e | J36: of:=MOD([.A36];19)+1 -> 10 | K36: of:=OFFSET([.$T$1];[.J36];0) -> VIII (h) | M36: of:=ORG.OPENOFFICE.ISLEAPYEAR([.D36]) -> 0 | N36: of:=WEEKDAY(DATE([.A36];1;1)) -> 4 | Q36: of:=[.R36]-[.F36] -> 214 | R36: of:=DATE([.A36];12;25) -> 2042-12-25
A37: of:=[Sheet2.A36] -> 2043 | B37: of:=[.D37]-63 -> 2043-01-25 | C37: of:=[.D37]-46 -> 2043-02-11 | D37: of:=[Sheet2.B36] -> 2043-03-29 | E37: of:=[.D37]+39 -> 2043-05-07 | F37: of:=[.D37]+49 -> 2043-05-17 | G37: of:=INT(([.Q37]-1)/7)-4 -> 27 | H37: of:=[.F37]+[.G37]*7+7 -> 2043-11-29 | I37: of:=OFFSET([.$S$1];[.N37];0) & IF([.M37];" " & OFFSET([.$S$1];[.N37]+1;0);"") -> d | J37: of:=MOD([.A37];19)+1 -> 11 | K37: of:=OFFSET([.$T$1];[.J37];0) -> XIX (u) | M37: of:=ORG.OPENOFFICE.ISLEAPYEAR([.D37]) -> 0 | N37: of:=WEEKDAY(DATE([.A37];1;1)) -> 5 | Q37: of:=[.R37]-[.F37] -> 222 | R37: of:=DATE([.A37];12;25) -> 2043-12-25
A38: of:=[Sheet2.A37] -> 2044 | B38: of:=[.D38]-63 -> 2044-02-14 | C38: of:=[.D38]-46 -> 2044-03-02 | D38: of:=[Sheet2.B37] -> 2044-04-17 | E38: of:=[.D38]+39 -> 2044-05-26 | F38: of:=[.D38]+49 -> 2044-06-05 | G38: of:=INT(([.Q38]-1)/7)-4 -> 24 | H38: of:=[.F38]+[.G38]*7+7 -> 2044-11-27 | I38: of:=OFFSET([.$S$1];[.N38];0) & IF([.M38];" " & OFFSET([.$S$1];[.N38]+1;0);"") -> c b | J38: of:=MOD([.A38];19)+1 -> 12 | K38: of:=OFFSET([.$T$1];[.J38];0) -> * (P) | M38: of:=ORG.OPENOFFICE.ISLEAPYEAR([.D38]) -> 1 | N38: of:=WEEKDAY(DATE([.A38];1;1)) -> 6 | Q38: of:=[.R38]-[.F38] -> 203 | R38: of:=DATE([.A38];12;25) -> 2044-12-25
A39: of:=[Sheet2.A38] -> 2045 | B39: of:=[.D39]-63 -> 2045-02-05 | C39: of:=[.D39]-46 -> 2045-02-22 | D39: of:=[Sheet2.B38] -> 2045-04-09 | E39: of:=[.D39]+39 -> 2045-05-18 | F39: of:=[.D39]+49 -> 2045-05-28 | G39: of:=INT(([.Q39]-1)/7)-4 -> 26 | H39: of:=[.F39]+[.G39]*7+7 -> 2045-12-03 | I39: of:=OFFSET([.$S$1];[.N39];0) & IF([.M39];" " & OFFSET([.$S$1];[.N39]+1;0);"") -> A | J39: of:=MOD([.A39];19)+1 -> 13 | K39: of:=OFFSET([.$T$1];[.J39];0) -> XI (l) | M39: of:=ORG.OPENOFFICE.ISLEAPYEAR([.D39]) -> 0 | N39: of:=WEEKDAY(DATE([.A39];1;1)) -> 1 | Q39: of:=[.R39]-[.F39] -> 211 | R39: of:=DATE([.A39];12;25) -> 2045-12-25
A40: of:=[Sheet2.A39] -> 2046 | B40: of:=[.D40]-63 -> 2046-01-21 | C40: of:=[.D40]-46 -> 2046-02-07 | D40: of:=[Sheet2.B39] -> 2046-03-25 | E40: of:=[.D40]+39 -> 2046-05-03 | F40: of:=[.D40]+49 -> 2046-05-13 | G40: of:=INT(([.Q40]-1)/7)-4 -> 28 | H40: of:=[.F40]+[.G40]*7+7 -> 2046-12-02 | I40: of:=OFFSET([.$S$1];[.N40];0) & IF([.M40];" " & OFFSET([.$S$1];[.N40]+1;0);"") -> g | J40: of:=MOD([.A40];19)+1 -> 14 | K40: of:=OFFSET([.$T$1];[.J40];0) -> XXII (C) | M40: of:=ORG.OPENOFFICE.ISLEAPYEAR([.D40]) -> 0 | N40: of:=WEEKDAY(DATE([.A40];1;1)) -> 2 | Q40: of:=[.R40]-[.F40] -> 226 | R40: of:=DATE([.A40];12;25) -> 2046-12-25
A41: of:=[Sheet2.A40] -> 2047 | B41: of:=[.D41]-63 -> 2047-02-10 | C41: of:=[.D41]-46 -> 2047-02-27 | D41: of:=[Sheet2.B40] -> 2047-04-14 | E41: of:=[.D41]+39 -> 2047-05-23 | F41: of:=[.D41]+49 -> 2047-06-02 | G41: of:=INT(([.Q41]-1)/7)-4 -> 25 | H41: of:=[.F41]+[.G41]*7+7 -> 2047-12-01 | I41: of:=OFFSET([.$S$1];[.N41];0) & IF([.M41];" " & OFFSET([.$S$1];[.N41]+1;0);"") -> f | J41: of:=MOD([.A41];19)+1 -> 15 | K41: of:=OFFSET([.$T$1];[.J41];0) -> III (c) | M41: of:=ORG.OPENOFFICE.ISLEAPYEAR([.D41]) -> 0 | N41: of:=WEEKDAY(DATE([.A41];1;1)) -> 3 | Q41: of:=[.R41]-[.F41] -> 206 | R41: of:=DATE([.A41];12;25) -> 2047-12-25

Sheet: Sheet2
A1: 2012 | B1: of:=[.K1] -> 2008-03-23 | C1: of:=MOD([.A1];19) -> 13 | D1: of:=MOD([.A1];4) -> 0 | E1: of:=MOD([.A1];7) -> 6 | F1: of:=MOD((19*[.C1]+[.H1]);30) -> 1 | G1: of:=MOD((2*[.D1]+4*[.E1]+6*[.F1]+[.I1]);7) -> 0 | H1: of:=IF([.A1]<1700;22;IF([.A1]<1900;23;IF([.A1]<2200;24;25))) -> 24 | I1: of:=IF([.A1]<1700;2;IF([.A1]<1800;3;IF([.A1]<1900;4;IF([.A1]<2100;5;IF([.A1]<2200;6;0))))) -> 5 | J1: of:=IF([.F1]+[.G1]=35;28;IF(AND([.F1]=28;[.G1]=6;[.C1]>10);27;[.F1]+[.G1])) -> 1 | K1: of:=DATE([.A1];3;22)+[.J1] -> 2008-03-23
A2: of:=[.A1]+1 -> 2009 | B2: of:=[.K2] -> 2009-04-12 | C2: of:=MOD([.A2];19) -> 14 | D2: of:=MOD([.A2];4) -> 1 | E2: of:=MOD([.A2];7) -> 0 | F2: of:=MOD((19*[.C2]+[.H2]);30) -> 20 | G2: of:=MOD((2*[.D2]+4*[.E2]+6*[.F2]+[.I2]);7) -> 1 | H2: of:=IF([.A2]<1700;22;IF([.A2]<1900;23;IF([.A2]<2200;24;25))) -> 24 | I2: of:=IF([.A2]<1700;2;IF([.A2]<1800;3;IF([.A2]<1900;4;IF([.A2]<2100;5;IF([.A2]<2200;6;0))))) -> 5 | J2: of:=IF([.F2]+[.G2]=35;28;IF(AND([.F2]=28;[.G2]=6;[.C2]>10);27;[.F2]+[.G2])) -> 21 | K2: of:=DATE([.A2];3;22)+[.J2] -> 2009-04-12
A3: of:=[.A2]+1 -> 2010 | B3: of:=[.K3] -> 2010-04-04 | C3: of:=MOD([.A3];19) -> 15 | D3: of:=MOD([.A3];4) -> 2 | E3: of:=MOD([.A3];7) -> 1 | F3: of:=MOD((19*[.C3]+[.H3]);30) -> 9 | G3: of:=MOD((2*[.D3]+4*[.E3]+6*[.F3]+[.I3]);7) -> 4 | H3: of:=IF([.A3]<1700;22;IF([.A3]<1900;23;IF([.A3]<2200;24;25))) -> 24 | I3: of:=IF([.A3]<1700;2;IF([.A3]<1800;3;IF([.A3]<1900;4;IF([.A3]<2100;5;IF([.A3]<2200;6;0))))) -> 5 | J3: of:=IF([.F3]+[.G3]=35;28;IF(AND([.F3]=28;[.G3]=6;[.C3]>10);27;[.F3]+[.G3])) -> 13 | K3: of:=DATE([.A3];3;22)+[.J3] -> 2010-04-04
A4: of:=[.A3]+1 -> 2011 | B4: of:=[.K4] -> 2011-04-24 | C4: of:=MOD([.A4];19) -> 16 | D4: of:=MOD([.A4];4) -> 3 | E4: of:=MOD([.A4];7) -> 2 | F4: of:=MOD((19*[.C4]+[.H4]);30) -> 28 | G4: of:=MOD((2*[.D4]+4*[.E4]+6*[.F4]+[.I4]);7) -> 5 | H4: of:=IF([.A4]<1700;22;IF([.A4]<1900;23;IF([.A4]<2200;24;25))) -> 24 | I4: of:=IF([.A4]<1700;2;IF([.A4]<1800;3;IF([.A4]<1900;4;IF([.A4]<2100;5;IF([.A4]<2200;6;0))))) -> 5 | J4: of:=IF([.F4]+[.G4]=35;28;IF(AND([.F4]=28;[.G4]=6;[.C4]>10);27;[.F4]+[.G4])) -> 33 | K4: of:=DATE([.A4];3;22)+[.J4] -> 2011-04-24
A5: of:=[.A4]+1 -> 2012 | B5: of:=[.K5] -> 2012-04-08 | C5: of:=MOD([.A5];19) -> 17 | D5: of:=MOD([.A5];4) -> 0 | E5: of:=MOD([.A5];7) -> 3 | F5: of:=MOD((19*[.C5]+[.H5]);30) -> 17 | G5: of:=MOD((2*[.D5]+4*[.E5]+6*[.F5]+[.I5]);7) -> 0 | H5: of:=IF([.A5]<1700;22;IF([.A5]<1900;23;IF([.A5]<2200;24;25))) -> 24 | I5: of:=IF([.A5]<1700;2;IF([.A5]<1800;3;IF([.A5]<1900;4;IF([.A5]<2100;5;IF([.A5]<2200;6;0))))) -> 5 | J5: of:=IF([.F5]+[.G5]=35;28;IF(AND([.F5]=28;[.G5]=6;[.C5]>10);27;[.F5]+[.G5])) -> 17 | K5: of:=DATE([.A5];3;22)+[.J5] -> 2012-04-08
A6: of:=[.A5]+1 -> 2013 | B6: of:=[.K6] -> 2013-03-31 | C6: of:=MOD([.A6];19) -> 18 | D6: of:=MOD([.A6];4) -> 1 | E6: of:=MOD([.A6];7) -> 4 | F6: of:=MOD((19*[.C6]+[.H6]);30) -> 6 | G6: of:=MOD((2*[.D6]+4*[.E6]+6*[.F6]+[.I6]);7) -> 3 | H6: of:=IF([.A6]<1700;22;IF([.A6]<1900;23;IF([.A6]<2200;24;25))) -> 24 | I6: of:=IF([.A6]<1700;2;IF([.A6]<1800;3;IF([.A6]<1900;4;IF([.A6]<2100;5;IF([.A6]<2200;6;0))))) -> 5 | J6: of:=IF([.F6]+[.G6]=35;28;IF(AND([.F6]=28;[.G6]=6;[.C6]>10);27;[.F6]+[.G6])) -> 9 | K6: of:=DATE([.A6];3;22)+[.J6] -> 2013-03-31
A7: of:=[.A6]+1 -> 2014 | B7: of:=[.K7] -> 2014-04-20 | C7: of:=MOD([.A7];19) -> 0 | D7: of:=MOD([.A7];4) -> 2 | E7: of:=MOD([.A7];7) -> 5 | F7: of:=MOD((19*[.C7]+[.H7]);30) -> 24 | G7: of:=MOD((2*[.D7]+4*[.E7]+6*[.F7]+[.I7]);7) -> 5 | H7: of:=IF([.A7]<1700;22;IF([.A7]<1900;23;IF([.A7]<2200;24;25))) -> 24 | I7: of:=IF([.A7]<1700;2;IF([.A7]<1800;3;IF([.A7]<1900;4;IF([.A7]<2100;5;IF([.A7]<2200;6;0))))) -> 5 | J7: of:=IF([.F7]+[.G7]=35;28;IF(AND([.F7]=28;[.G7]=6;[.C7]>10);27;[.F7]+[.G7])) -> 29 | K7: of:=DATE([.A7];3;22)+[.J7] -> 2014-04-20
A8: of:=[.A7]+1 -> 2015 | B8: of:=[.K8] -> 2015-04-05 | C8: of:=MOD([.A8];19) -> 1 | D8: of:=MOD([.A8];4) -> 3 | E8: of:=MOD([.A8];7) -> 6 | F8: of:=MOD((19*[.C8]+[.H8]);30) -> 13 | G8: of:=MOD((2*[.D8]+4*[.E8]+6*[.F8]+[.I8]);7) -> 1 | H8: of:=IF([.A8]<1700;22;IF([.A8]<1900;23;IF([.A8]<2200;24;25))) -> 24 | I8: of:=IF([.A8]<1700;2;IF([.A8]<1800;3;IF([.A8]<1900;4;IF([.A8]<2100;5;IF([.A8]<2200;6;0))))) -> 5 | J8: of:=IF([.F8]+[.G8]=35;28;IF(AND([.F8]=28;[.G8]=6;[.C8]>10);27;[.F8]+[.G8])) -> 14 | K8: of:=DATE([.A8];3;22)+[.J8] -> 2015-04-05
A9: of:=[.A8]+1 -> 2016 | B9: of:=[.K9] -> 2016-03-27 | C9: of:=MOD([.A9];19) -> 2 | D9: of:=MOD([.A9];4) -> 0 | E9: of:=MOD([.A9];7) -> 0 | F9: of:=MOD((19*[.C9]+[.H9]);30) -> 2 | G9: of:=MOD((2*[.D9]+4*[.E9]+6*[.F9]+[.I9]);7) -> 3 | H9: of:=IF([.A9]<1700;22;IF([.A9]<1900;23;IF([.A9]<2200;24;25))) -> 24 | I9: of:=IF([.A9]<1700;2;IF([.A9]<1800;3;IF([.A9]<1900;4;IF([.A9]<2100;5;IF([.A9]<2200;6;0))))) -> 5 | J9: of:=IF([.F9]+[.G9]=35;28;IF(AND([.F9]=28;[.G9]=6;[.C9]>10);27;[.F9]+[.G9])) -> 5 | K9: of:=DATE([.A9];3;22)+[.J9] -> 2016-03-27
A10: of:=[.A9]+1 -> 2017 | B10: of:=[.K10] -> 2017-04-16 | C10: of:=MOD([.A10];19) -> 3 | D10: of:=MOD([.A10];4) -> 1 | E10: of:=MOD([.A10];7) -> 1 | F10: of:=MOD((19*[.C10]+[.H10]);30) -> 21 | G10: of:=MOD((2*[.D10]+4*[.E10]+6*[.F10]+[.I10]);7) -> 4 | H10: of:=IF([.A10]<1700;22;IF([.A10]<1900;23;IF([.A10]<2200;24;25))) -> 24 | I10: of:=IF([.A10]<1700;2;IF([.A10]<1800;3;IF([.A10]<1900;4;IF([.A10]<2100;5;IF([.A10]<2200;6;0))))) -> 5 | J10: of:=IF([.F10]+[.G10]=35;28;IF(AND([.F10]=28;[.G10]=6;[.C10]>10);27;[.F10]+[.G10])) -> 25 | K10: of:=DATE([.A10];3;22)+[.J10] -> 2017-04-16
A11: of:=[.A10]+1 -> 2018 | B11: of:=[.K11] -> 2018-04-01 | C11: of:=MOD([.A11];19) -> 4 | D11: of:=MOD([.A11];4) -> 2 | E11: of:=MOD([.A11];7) -> 2 | F11: of:=MOD((19*[.C11]+[.H11]);30) -> 10 | G11: of:=MOD((2*[.D11]+4*[.E11]+6*[.F11]+[.I11]);7) -> 0 | H11: of:=IF([.A11]<1700;22;IF([.A11]<1900;23;IF([.A11]<2200;24;25))) -> 24 | I11: of:=IF([.A11]<1700;2;IF([.A11]<1800;3;IF([.A11]<1900;4;IF([.A11]<2100;5;IF([.A11]<2200;6;0))))) -> 5 | J11: of:=IF([.F11]+[.G11]=35;28;IF(AND([.F11]=28;[.G11]=6;[.C11]>10);27;[.F11]+[.G11])) -> 10 | K11: of:=DATE([.A11];3;22)+[.J11] -> 2018-04-01
A12: of:=[.A11]+1 -> 2019 | B12: of:=[.K12] -> 2019-04-21 | C12: of:=MOD([.A12];19) -> 5 | D12: of:=MOD([.A12];4) -> 3 | E12: of:=MOD([.A12];7) -> 3 | F12: of:=MOD((19*[.C12]+[.H12]);30) -> 29 | G12: of:=MOD((2*[.D12]+4*[.E12]+6*[.F12]+[.I12]);7) -> 1 | H12: of:=IF([.A12]<1700;22;IF([.A12]<1900;23;IF([.A12]<2200;24;25))) -> 24 | I12: of:=IF([.A12]<1700;2;IF([.A12]<1800;3;IF([.A12]<1900;4;IF([.A12]<2100;5;IF([.A12]<2200;6;0))))) -> 5 | J12: of:=IF([.F12]+[.G12]=35;28;IF(AND([.F12]=28;[.G12]=6;[.C12]>10);27;[.F12]+[.G12])) -> 30 | K12: of:=DATE([.A12];3;22)+[.J12] -> 2019-04-21
A13: of:=[.A12]+1 -> 2020 | B13: of:=[.K13] -> 2020-04-12 | C13: of:=MOD([.A13];19) -> 6 | D13: of:=MOD([.A13];4) -> 0 | E13: of:=MOD([.A13];7) -> 4 | F13: of:=MOD((19*[.C13]+[.H13]);30) -> 18 | G13: of:=MOD((2*[.D13]+4*[.E13]+6*[.F13]+[.I13]);7) -> 3 | H13: of:=IF([.A13]<1700;22;IF([.A13]<1900;23;IF([.A13]<2200;24;25))) -> 24 | I13: of:=IF([.A13]<1700;2;IF([.A13]<1800;3;IF([.A13]<1900;4;IF([.A13]<2100;5;IF([.A13]<2200;6;0))))) -> 5 | J13: of:=IF([.F13]+[.G13]=35;28;IF(AND([.F13]=28;[.G13]=6;[.C13]>10);27;[.F13]+[.G13])) -> 21 | K13: of:=DATE([.A13];3;22)+[.J13] -> 2020-04-12
A14: of:=[.A13]+1 -> 2021 | B14: of:=[.K14] -> 2021-04-04 | C14: of:=MOD([.A14];19) -> 7 | D14: of:=MOD([.A14];4) -> 1 | E14: of:=MOD([.A14];7) -> 5 | F14: of:=MOD((19*[.C14]+[.H14]);30) -> 7 | G14: of:=MOD((2*[.D14]+4*[.E14]+6*[.F14]+[.I14]);7) -> 6 | H14: of:=IF([.A14]<1700;22;IF([.A14]<1900;23;IF([.A14]<2200;24;25))) -> 24 | I14: of:=IF([.A14]<1700;2;IF([.A14]<1800;3;IF([.A14]<1900;4;IF([.A14]<2100;5;IF([.A14]<2200;6;0))))) -> 5 | J14: of:=IF([.F14]+[.G14]=35;28;IF(AND([.F14]=28;[.G14]=6;[.C14]>10);27;[.F14]+[.G14])) -> 13 | K14: of:=DATE([.A14];3;22)+[.J14] -> 2021-04-04
A15: of:=[.A14]+1 -> 2022 | B15: of:=[.K15] -> 2022-04-17 | C15: of:=MOD([.A15];19) -> 8 | D15: of:=MOD([.A15];4) -> 2 | E15: of:=MOD([.A15];7) -> 6 | F15: of:=MOD((19*[.C15]+[.H15]);30) -> 26 | G15: of:=MOD((2*[.D15]+4*[.E15]+6*[.F15]+[.I15]);7) -> 0 | H15: of:=IF([.A15]<1700;22;IF([.A15]<1900;23;IF([.A15]<2200;24;25))) -> 24 | I15: of:=IF([.A15]<1700;2;IF([.A15]<1800;3;IF([.A15]<1900;4;IF([.A15]<2100;5;IF([.A15]<2200;6;0))))) -> 5 | J15: of:=IF([.F15]+[.G15]=35;28;IF(AND([.F15]=28;[.G15]=6;[.C15]>10);27;[.F15]+[.G15])) -> 26 | K15: of:=DATE([.A15];3;22)+[.J15] -> 2022-04-17
A16: of:=[.A15]+1 -> 2023 | B16: of:=[.K16] -> 2023-04-09 | C16: of:=MOD([.A16];19) -> 9 | D16: of:=MOD([.A16];4) -> 3 | E16: of:=MOD([.A16];7) -> 0 | F16: of:=MOD((19*[.C16]+[.H16]);30) -> 15 | G16: of:=MOD((2*[.D16]+4*[.E16]+6*[.F16]+[.I16]);7) -> 3 | H16: of:=IF([.A16]<1700;22;IF([.A16]<1900;23;IF([.A16]<2200;24;25))) -> 24 | I16: of:=IF([.A16]<1700;2;IF([.A16]<1800;3;IF([.A16]<1900;4;IF([.A16]<2100;5;IF([.A16]<2200;6;0))))) -> 5 | J16: of:=IF([.F16]+[.G16]=35;28;IF(AND([.F16]=28;[.G16]=6;[.C16]>10);27;[.F16]+[.G16])) -> 18 | K16: of:=DATE([.A16];3;22)+[.J16] -> 2023-04-09
A17: of:=[.A16]+1 -> 2024 | B17: of:=[.K17] -> 2024-03-31 | C17: of:=MOD([.A17];19) -> 10 | D17: of:=MOD([.A17];4) -> 0 | E17: of:=MOD([.A17];7) -> 1 | F17: of:=MOD((19*[.C17]+[.H17]);30) -> 4 | G17: of:=MOD((2*[.D17]+4*[.E17]+6*[.F17]+[.I17]);7) -> 5 | H17: of:=IF([.A17]<1700;22;IF([.A17]<1900;23;IF([.A17]<2200;24;25))) -> 24 | I17: of:=IF([.A17]<1700;2;IF([.A17]<1800;3;IF([.A17]<1900;4;IF([.A17]<2100;5;IF([.A17]<2200;6;0))))) -> 5 | J17: of:=IF([.F17]+[.G17]=35;28;IF(AND([.F17]=28;[.G17]=6;[.C17]>10);27;[.F17]+[.G17])) -> 9 | K17: of:=DATE([.A17];3;22)+[.J17] -> 2024-03-31
A18: of:=[.A17]+1 -> 2025 | B18: of:=[.K18] -> 2025-04-20 | C18: of:=MOD([.A18];19) -> 11 | D18: of:=MOD([.A18];4) -> 1 | E18: of:=MOD([.A18];7) -> 2 | F18: of:=MOD((19*[.C18]+[.H18]);30) -> 23 | G18: of:=MOD((2*[.D18]+4*[.E18]+6*[.F18]+[.I18]);7) -> 6 | H18: of:=IF([.A18]<1700;22;IF([.A18]<1900;23;IF([.A18]<2200;24;25))) -> 24 | I18: of:=IF([.A18]<1700;2;IF([.A18]<1800;3;IF([.A18]<1900;4;IF([.A18]<2100;5;IF([.A18]<2200;6;0))))) -> 5 | J18: of:=IF([.F18]+[.G18]=35;28;IF(AND([.F18]=28;[.G18]=6;[.C18]>10);27;[.F18]+[.G18])) -> 29 | K18: of:=DATE([.A18];3;22)+[.J18] -> 2025-04-20
A19: of:=[.A18]+1 -> 2026 | B19: of:=[.K19] -> 2026-04-05 | C19: of:=MOD([.A19];19) -> 12 | D19: of:=MOD([.A19];4) -> 2 | E19: of:=MOD([.A19];7) -> 3 | F19: of:=MOD((19*[.C19]+[.H19]);30) -> 12 | G19: of:=MOD((2*[.D19]+4*[.E19]+6*[.F19]+[.I19]);7) -> 2 | H19: of:=IF([.A19]<1700;22;IF([.A19]<1900;23;IF([.A19]<2200;24;25))) -> 24 | I19: of:=IF([.A19]<1700;2;IF([.A19]<1800;3;IF([.A19]<1900;4;IF([.A19]<2100;5;IF([.A19]<2200;6;0))))) -> 5 | J19: of:=IF([.F19]+[.G19]=35;28;IF(AND([.F19]=28;[.G19]=6;[.C19]>10);27;[.F19]+[.G19])) -> 14 | K19: of:=DATE([.A19];3;22)+[.J19] -> 2026-04-05
A20: of:=[.A19]+1 -> 2027 | B20: of:=[.K20] -> 2027-03-28 | C20: of:=MOD([.A20];19) -> 13 | D20: of:=MOD([.A20];4) -> 3 | E20: of:=MOD([.A20];7) -> 4 | F20: of:=MOD((19*[.C20]+[.H20]);30) -> 1 | G20: of:=MOD((2*[.D20]+4*[.E20]+6*[.F20]+[.I20]);7) -> 5 | H20: of:=IF([.A20]<1700;22;IF([.A20]<1900;23;IF([.A20]<2200;24;25))) -> 24 | I20: of:=IF([.A20]<1700;2;IF([.A20]<1800;3;IF([.A20]<1900;4;IF([.A20]<2100;5;IF([.A20]<2200;6;0))))) -> 5 | J20: of:=IF([.F20]+[.G20]=35;28;IF(AND([.F20]=28;[.G20]=6;[.C20]>10);27;[.F20]+[.G20])) -> 6 | K20: of:=DATE([.A20];3;22)+[.J20] -> 2027-03-28
A21: of:=[.A20]+1 -> 2028 | B21: of:=[.K21] -> 2028-04-16 | C21: of:=MOD([.A21];19) -> 14 | D21: of:=MOD([.A21];4) -> 0 | E21: of:=MOD([.A21];7) -> 5 | F21: of:=MOD((19*[.C21]+[.H21]);30) -> 20 | G21: of:=MOD((2*[.D21]+4*[.E21]+6*[.F21]+[.I21]);7) -> 5 | H21: of:=IF([.A21]<1700;22;IF([.A21]<1900;23;IF([.A21]<2200;24;25))) -> 24 | I21: of:=IF([.A21]<1700;2;IF([.A21]<1800;3;IF([.A21]<1900;4;IF([.A21]<2100;5;IF([.A21]<2200;6;0))))) -> 5 | J21: of:=IF([.F21]+[.G21]=35;28;IF(AND([.F21]=28;[.G21]=6;[.C21]>10);27;[.F21]+[.G21])) -> 25 | K21: of:=DATE([.A21];3;22)+[.J21] -> 2028-04-16
A22: of:=[.A21]+1 -> 2029 | B22: of:=[.K22] -> 2029-04-01 | C22: of:=MOD([.A22];19) -> 15 | D22: of:=MOD([.A22];4) -> 1 | E22: of:=MOD([.A22];7) -> 6 | F22: of:=MOD((19*[.C22]+[.H22]);30) -> 9 | G22: of:=MOD((2*[.D22]+4*[.E22]+6*[.F22]+[.I22]);7) -> 1 | H22: of:=IF([.A22]<1700;22;IF([.A22]<1900;23;IF([.A22]<2200;24;25))) -> 24 | I22: of:=IF([.A22]<1700;2;IF([.A22]<1800;3;IF([.A22]<1900;4;IF([.A22]<2100;5;IF([.A22]<2200;6;0))))) -> 5 | J22: of:=IF([.F22]+[.G22]=35;28;IF(AND([.F22]=28;[.G22]=6;[.C22]>10);27;[.F22]+[.G22])) -> 10 | K22: of:=DATE([.A22];3;22)+[.J22] -> 2029-04-01
A23: of:=[.A22]+1 -> 2030 | B23: of:=[.K23] -> 2030-04-21 | C23: of:=MOD([.A23];19) -> 16 | D23: of:=MOD([.A23];4) -> 2 | E23: of:=MOD([.A23];7) -> 0 | F23: of:=MOD((19*[.C23]+[.H23]);30) -> 28 | G23: of:=MOD((2*[.D23]+4*[.E23]+6*[.F23]+[.I23]);7) -> 2 | H23: of:=IF([.A23]<1700;22;IF([.A23]<1900;23;IF([.A23]<2200;24;25))) -> 24 | I23: of:=IF([.A23]<1700;2;IF([.A23]<1800;3;IF([.A23]<1900;4;IF([.A23]<2100;5;IF([.A23]<2200;6;0))))) -> 5 | J23: of:=IF([.F23]+[.G23]=35;28;IF(AND([.F23]=28;[.G23]=6;[.C23]>10);27;[.F23]+[.G23])) -> 30 | K23: of:=DATE([.A23];3;22)+[.J23] -> 2030-04-21
A24: of:=[.A23]+1 -> 2031 | B24: of:=[.K24] -> 2031-04-13 | C24: of:=MOD([.A24];19) -> 17 | D24: of:=MOD([.A24];4) -> 3 | E24: of:=MOD([.A24];7) -> 1 | F24: of:=MOD((19*[.C24]+[.H24]);30) -> 17 | G24: of:=MOD((2*[.D24]+4*[.E24]+6*[.F24]+[.I24]);7) -> 5 | H24: of:=IF([.A24]<1700;22;IF([.A24]<1900;23;IF([.A24]<2200;24;25))) -> 24 | I24: of:=IF([.A24]<1700;2;IF([.A24]<1800;3;IF([.A24]<1900;4;IF([.A24]<2100;5;IF([.A24]<2200;6;0))))) -> 5 | J24: of:=IF([.F24]+[.G24]=35;28;IF(AND([.F24]=28;[.G24]=6;[.C24]>10);27;[.F24]+[.G24])) -> 22 | K24: of:=DATE([.A24];3;22)+[.J24] -> 2031-04-13
A25: of:=[.A24]+1 -> 2032 | B25: of:=[.K25] -> 2032-03-28 | C25: of:=MOD([.A25];19) -> 18 | D25: of:=MOD([.A25];4) -> 0 | E25: of:=MOD([.A25];7) -> 2 | F25: of:=MOD((19*[.C25]+[.H25]);30) -> 6 | G25: of:=MOD((2*[.D25]+4*[.E25]+6*[.F25]+[.I25]);7) -> 0 | H25: of:=IF([.A25]<1700;22;IF([.A25]<1900;23;IF([.A25]<2200;24;25))) -> 24 | I25: of:=IF([.A25]<1700;2;IF([.A25]<1800;3;IF([.A25]<1900;4;IF([.A25]<2100;5;IF([.A25]<2200;6;0))))) -> 5 | J25: of:=IF([.F25]+[.G25]=35;28;IF(AND([.F25]=28;[.G25]=6;[.C25]>10);27;[.F25]+[.G25])) -> 6 | K25: of:=DATE([.A25];3;22)+[.J25] -> 2032-03-28
A26: of:=[.A25]+1 -> 2033 | B26: of:=[.K26] -> 2033-04-17 | C26: of:=MOD([.A26];19) -> 0 | D26: of:=MOD([.A26];4) -> 1 | E26: of:=MOD([.A26];7) -> 3 | F26: of:=MOD((19*[.C26]+[.H26]);30) -> 24 | G26: of:=MOD((2*[.D26]+4*[.E26]+6*[.F26]+[.I26]);7) -> 2 | H26: of:=IF([.A26]<1700;22;IF([.A26]<1900;23;IF([.A26]<2200;24;25))) -> 24 | I26: of:=IF([.A26]<1700;2;IF([.A26]<1800;3;IF([.A26]<1900;4;IF([.A26]<2100;5;IF([.A26]<2200;6;0))))) -> 5 | J26: of:=IF([.F26]+[.G26]=35;28;IF(AND([.F26]=28;[.G26]=6;[.C26]>10);27;[.F26]+[.G26])) -> 26 | K26: of:=DATE([.A26];3;22)+[.J26] -> 2033-04-17
A27: of:=[.A26]+1 -> 2034 | B27: of:=[.K27] -> 2034-04-09 | C27: of:=MOD([.A27];19) -> 1 | D27: of:=MOD([.A27];4) -> 2 | E27: of:=MOD([.A27];7) -> 4 | F27: of:=MOD((19*[.C27]+[.H27]);30) -> 13 | G27: of:=MOD((2*[.D27]+4*[.E27]+6*[.F27]+[.I27]);7) -> 5 | H27: of:=IF([.A27]<1700;22;IF([.A27]<1900;23;IF([.A27]<2200;24;25))) -> 24 | I27: of:=IF([.A27]<1700;2;IF([.A27]<1800;3;IF([.A27]<1900;4;IF([.A27]<2100;5;IF([.A27]<2200;6;0))))) -> 5 | J27: of:=IF([.F27]+[.G27]=35;28;IF(AND([.F27]=28;[.G27]=6;[.C27]>10);27;[.F27]+[.G27])) -> 18 | K27: of:=DATE([.A27];3;22)+[.J27] -> 2034-04-09
A28: of:=[.A27]+1 -> 2035 | B28: of:=[.K28] -> 2035-03-25 | C28: of:=MOD([.A28];19) -> 2 | D28: of:=MOD([.A28];4) -> 3 | E28: of:=MOD([.A28];7) -> 5 | F28: of:=MOD((19*[.C28]+[.H28]);30) -> 2 | G28: of:=MOD((2*[.D28]+4*[.E28]+6*[.F28]+[.I28]);7) -> 1 | H28: of:=IF([.A28]<1700;22;IF([.A28]<1900;23;IF([.A28]<2200;24;25))) -> 24 | I28: of:=IF([.A28]<1700;2;IF([.A28]<1800;3;IF([.A28]<1900;4;IF([.A28]<2100;5;IF([.A28]<2200;6;0))))) -> 5 | J28: of:=IF([.F28]+[.G28]=35;28;IF(AND([.F28]=28;[.G28]=6;[.C28]>10);27;[.F28]+[.G28])) -> 3 | K28: of:=DATE([.A28];3;22)+[.J28] -> 2035-03-25
A29: of:=[.A28]+1 -> 2036 | B29: of:=[.K29] -> 2036-04-13 | C29: of:=MOD([.A29];19) -> 3 | D29: of:=MOD([.A29];4) -> 0 | E29: of:=MOD([.A29];7) -> 6 | F29: of:=MOD((19*[.C29]+[.H29]);30) -> 21 | G29: of:=MOD((2*[.D29]+4*[.E29]+6*[.F29]+[.I29]);7) -> 1 | H29: of:=IF([.A29]<1700;22;IF([.A29]<1900;23;IF([.A29]<2200;24;25))) -> 24 | I29: of:=IF([.A29]<1700;2;IF([.A29]<1800;3;IF([.A29]<1900;4;IF([.A29]<2100;5;IF([.A29]<2200;6;0))))) -> 5 | J29: of:=IF([.F29]+[.G29]=35;28;IF(AND([.F29]=28;[.G29]=6;[.C29]>10);27;[.F29]+[.G29])) -> 22 | K29: of:=DATE([.A29];3;22)+[.J29] -> 2036-04-13
A30: of:=[.A29]+1 -> 2037 | B30: of:=[.K30] -> 2037-04-05 | C30: of:=MOD([.A30];19) -> 4 | D30: of:=MOD([.A30];4) -> 1 | E30: of:=MOD([.A30];7) -> 0 | F30: of:=MOD((19*[.C30]+[.H30]);30) -> 10 | G30: of:=MOD((2*[.D30]+4*[.E30]+6*[.F30]+[.I30]);7) -> 4 | H30: of:=IF([.A30]<1700;22;IF([.A30]<1900;23;IF([.A30]<2200;24;25))) -> 24 | I30: of:=IF([.A30]<1700;2;IF([.A30]<1800;3;IF([.A30]<1900;4;IF([.A30]<2100;5;IF([.A30]<2200;6;0))))) -> 5 | J30: of:=IF([.F30]+[.G30]=35;28;IF(AND([.F30]=28;[.G30]=6;[.C30]>10);27;[.F30]+[.G30])) -> 14 | K30: of:=DATE([.A30];3;22)+[.J30] -> 2037-04-05
A31: of:=[.A30]+1 -> 2038 | B31: of:=[.K31] -> 2038-04-25 | C31: of:=MOD([.A31];19) -> 5 | D31: of:=MOD([.A31];4) -> 2 | E31: of:=MOD([.A31];7) -> 1 | F31: of:=MOD((19*[.C31]+[.H31]);30) -> 29 | G31: of:=MOD((2*[.D31]+4*[.E31]+6*[.F31]+[.I31]);7) -> 5 | H31: of:=IF([.A31]<1700;22;IF([.A31]<1900;23;IF([.A31]<2200;24;25))) -> 24 | I31: of:=IF([.A31]<1700;2;IF([.A31]<1800;3;IF([.A31]<1900;4;IF([.A31]<2100;5;IF([.A31]<2200;6;0))))) -> 5 | J31: of:=IF([.F31]+[.G31]=35;28;IF(AND([.F31]=28;[.G31]=6;[.C31]>10);27;[.F31]+[.G31])) -> 34 | K31: of:=DATE([.A31];3;22)+[.J31] -> 2038-04-25
A32: of:=[.A31]+1 -> 2039 | B32: of:=[.K32] -> 2039-04-10 | C32: of:=MOD([.A32];19) -> 6 | D32: of:=MOD([.A32];4) -> 3 | E32: of:=MOD([.A32];7) -> 2 | F32: of:=MOD((19*[.C32]+[.H32]);30) -> 18 | G32: of:=MOD((2*[.D32]+4*[.E32]+6*[.F32]+[.I32]);7) -> 1 | H32: of:=IF([.A32]<1700;22;IF([.A32]<1900;23;IF([.A32]<2200;24;25))) -> 24 | I32: of:=IF([.A32]<1700;2;IF([.A32]<1800;3;IF([.A32]<1900;4;IF([.A32]<2100;5;IF([.A32]<2200;6;0))))) -> 5 | J32: of:=IF([.F32]+[.G32]=35;28;IF(AND([.F32]=28;[.G32]=6;[.C32]>10);27;[.F32]+[.G32])) -> 19 | K32: of:=DATE([.A32];3;22)+[.J32] -> 2039-04-10
A33: of:=[.A32]+1 -> 2040 | B33: of:=[.K33] -> 2040-04-01 | C33: of:=MOD([.A33];19) -> 7 | D33: of:=MOD([.A33];4) -> 0 | E33: of:=MOD([.A33];7) -> 3 | F33: of:=MOD((19*[.C33]+[.H33]);30) -> 7 | G33: of:=MOD((2*[.D33]+4*[.E33]+6*[.F33]+[.I33]);7) -> 3 | H33: of:=IF([.A33]<1700;22;IF([.A33]<1900;23;IF([.A33]<2200;24;25))) -> 24 | I33: of:=IF([.A33]<1700;2;IF([.A33]<1800;3;IF([.A33]<1900;4;IF([.A33]<2100;5;IF([.A33]<2200;6;0))))) -> 5 | J33: of:=IF([.F33]+[.G33]=35;28;IF(AND([.F33]=28;[.G33]=6;[.C33]>10);27;[.F33]+[.G33])) -> 10 | K33: of:=DATE([.A33];3;22)+[.J33] -> 2040-04-01
A34: of:=[.A33]+1 -> 2041 | B34: of:=[.K34] -> 2041-04-21 | C34: of:=MOD([.A34];19) -> 8 | D34: of:=MOD([.A34];4) -> 1 | E34: of:=MOD([.A34];7) -> 4 | F34: of:=MOD((19*[.C34]+[.H34]);30) -> 26 | G34: of:=MOD((2*[.D34]+4*[.E34]+6*[.F34]+[.I34]);7) -> 4 | H34: of:=IF([.A34]<1700;22;IF([.A34]<1900;23;IF([.A34]<2200;24;25))) -> 24 | I34: of:=IF([.A34]<1700;2;IF([.A34]<1800;3;IF([.A34]<1900;4;IF([.A34]<2100;5;IF([.A34]<2200;6;0))))) -> 5 | J34: of:=IF([.F34]+[.G34]=35;28;IF(AND([.F34]=28;[.G34]=6;[.C34]>10);27;[.F34]+[.G34])) -> 30 | K34: of:=DATE([.A34];3;22)+[.J34] -> 2041-04-21
A35: of:=[.A34]+1 -> 2042 | B35: of:=[.K35] -> 2042-04-06 | C35: of:=MOD([.A35];19) -> 9 | D35: of:=MOD([.A35];4) -> 2 | E35: of:=MOD([.A35];7) -> 5 | F35: of:=MOD((19*[.C35]+[.H35]);30) -> 15 | G35: of:=MOD((2*[.D35]+4*[.E35]+6*[.F35]+[.I35]);7) -> 0 | H35: of:=IF([.A35]<1700;22;IF([.A35]<1900;23;IF([.A35]<2200;24;25))) -> 24 | I35: of:=IF([.A35]<1700;2;IF([.A35]<1800;3;IF([.A35]<1900;4;IF([.A35]<2100;5;IF([.A35]<2200;6;0))))) -> 5 | J35: of:=IF([.F35]+[.G35]=35;28;IF(AND([.F35]=28;[.G35]=6;[.C35]>10);27;[.F35]+[.G35])) -> 15 | K35: of:=DATE([.A35];3;22)+[.J35] -> 2042-04-06
A36: of:=[.A35]+1 -> 2043 | B36: of:=[.K36] -> 2043-03-29 | C36: of:=MOD([.A36];19) -> 10 | D36: of:=MOD([.A36];4) -> 3 | E36: of:=MOD([.A36];7) -> 6 | F36: of:=MOD((19*[.C36]+[.H36]);30) -> 4 | G36: of:=MOD((2*[.D36]+4*[.E36]+6*[.F36]+[.I36]);7) -> 3 | H36: of:=IF([.A36]<1700;22;IF([.A36]<1900;23;IF([.A36]<2200;24;25))) -> 24 | I36: of:=IF([.A36]<1700;2;IF([.A36]<1800;3;IF([.A36]<1900;4;IF([.A36]<2100;5;IF([.A36]<2200;6;0))))) -> 5 | J36: of:=IF([.F36]+[.G36]=35;28;IF(AND([.F36]=28;[.G36]=6;[.C36]>10);27;[.F36]+[.G36])) -> 7 | K36: of:=DATE([.A36];3;22)+[.J36] -> 2043-03-29
A37: of:=[.A36]+1 -> 2044 | B37: of:=[.K37] -> 2044-04-17 | C37: of:=MOD([.A37];19) -> 11 | D37: of:=MOD([.A37];4) -> 0 | E37: of:=MOD([.A37];7) -> 0 | F37: of:=MOD((19*[.C37]+[.H37]);30) -> 23 | G37: of:=MOD((2*[.D37]+4*[.E37]+6*[.F37]+[.I37]);7) -> 3 | H37: of:=IF([.A37]<1700;22;IF([.A37]<1900;23;IF([.A37]<2200;24;25))) -> 24 | I37: of:=IF([.A37]<1700;2;IF([.A37]<1800;3;IF([.A37]<1900;4;IF([.A37]<2100;5;IF([.A37]<2200;6;0))))) -> 5 | J37: of:=IF([.F37]+[.G37]=35;28;IF(AND([.F37]=28;[.G37]=6;[.C37]>10);27;[.F37]+[.G37])) -> 26 | K37: of:=DATE([.A37];3;22)+[.J37] -> 2044-04-17
A38: of:=[.A37]+1 -> 2045 | B38: of:=[.K38] -> 2045-04-09 | C38: of:=MOD([.A38];19) -> 12 | D38: of:=MOD([.A38];4) -> 1 | E38: of:=MOD([.A38];7) -> 1 | F38: of:=MOD((19*[.C38]+[.H38]);30) -> 12 | G38: of:=MOD((2*[.D38]+4*[.E38]+6*[.F38]+[.I38]);7) -> 6 | H38: of:=IF([.A38]<1700;22;IF([.A38]<1900;23;IF([.A38]<2200;24;25))) -> 24 | I38: of:=IF([.A38]<1700;2;IF([.A38]<1800;3;IF([.A38]<1900;4;IF([.A38]<2100;5;IF([.A38]<2200;6;0))))) -> 5 | J38: of:=IF([.F38]+[.G38]=35;28;IF(AND([.F38]=28;[.G38]=6;[.C38]>10);27;[.F38]+[.G38])) -> 18 | K38: of:=DATE([.A38];3;22)+[.J38] -> 2045-04-09
A39: of:=[.A38]+1 -> 2046 | B39: of:=[.K39] -> 2046-03-25 | C39: of:=MOD([.A39];19) -> 13 | D39: of:=MOD([.A39];4) -> 2 | E39: of:=MOD([.A39];7) -> 2 | F39: of:=MOD((19*[.C39]+[.H39]);30) -> 1 | G39: of:=MOD((2*[.D39]+4*[.E39]+6*[.F39]+[.I39]);7) -> 2 | H39: of:=IF([.A39]<1700;22;IF([.A39]<1900;23;IF([.A39]<2200;24;25))) -> 24 | I39: of:=IF([.A39]<1700;2;IF([.A39]<1800;3;IF([.A39]<1900;4;IF([.A39]<2100;5;IF([.A39]<2200;6;0))))) -> 5 | J39: of:=IF([.F39]+[.G39]=35;28;IF(AND([.F39]=28;[.G39]=6;[.C39]>10);27;[.F39]+[.G39])) -> 3 | K39: of:=DATE([.A39];3;22)+[.J39] -> 2046-03-25
A40: of:=[.A39]+1 -> 2047 | B40: of:=[.K40] -> 2047-04-14 | C40: of:=MOD([.A40];19) -> 14 | D40: of:=MOD([.A40];4) -> 3 | E40: of:=MOD([.A40];7) -> 3 | F40: of:=MOD((19*[.C40]+[.H40]);30) -> 20 | G40: of:=MOD((2*[.D40]+4*[.E40]+6*[.F40]+[.I40]);7) -> 3 | H40: of:=IF([.A40]<1700;22;IF([.A40]<1900;23;IF([.A40]<2200;24;25))) -> 24 | I40: of:=IF([.A40]<1700;2;IF([.A40]<1800;3;IF([.A40]<1900;4;IF([.A40]<2100;5;IF([.A40]<2200;6;0))))) -> 5 | J40: of:=IF([.F40]+[.G40]=35;28;IF(AND([.F40]=28;[.G40]=6;[.C40]>10);27;[.F40]+[.G40])) -> 23 | K40: of:=DATE([.A40];3;22)+[.J40] -> 2047-04-14
A41: of:=[.A40]+1 -> 2048 | B41: of:=[.K41] -> 2048-04-05 | C41: of:=MOD([.A41];19) -> 15 | D41: of:=MOD([.A41];4) -> 0 | E41: of:=MOD([.A41];7) -> 4 | F41: of:=MOD((19*[.C41]+[.H41]);30) -> 9 | G41: of:=MOD((2*[.D41]+4*[.E41]+6*[.F41]+[.I41]);7) -> 5 | H41: of:=IF([.A41]<1700;22;IF([.A41]<1900;23;IF([.A41]<2200;24;25))) -> 24 | I41: of:=IF([.A41]<1700;2;IF([.A41]<1800;3;IF([.A41]<1900;4;IF([.A41]<2100;5;IF([.A41]<2200;6;0))))) -> 5 | J41: of:=IF([.F41]+[.G41]=35;28;IF(AND([.F41]=28;[.G41]=6;[.C41]>10);27;[.F41]+[.G41])) -> 14 | K41: of:=DATE([.A41];3;22)+[.J41] -> 2048-04-05